user,senti_text_processed,sentimenal_res
Paris,"welcome to the police officers of the th class of peacekeepers!the minister of the interior and overseas territories presented them with the symbolic red fourragre, on the occasion of their arrival ceremony at the . throwback to this ceremony.","{'Negative': 0.0013139122, 'Neutral': 0.15022907, 'Positive': 0.84845704}"
Paris,"welcome ceremony for the peacekeepers of the th class assigned to the prefecture of police.guardians of the peace, you are the pillars of public order, a bulwark against delinquency, the defenders of the republic.","{'Negative': 0.010665415, 'Neutral': 0.3092052, 'Positive': 0.68012935}"
Paris,"national operation for the simplified abandonment of weapons to the state in the paris conurbation from november to december , .objectif: allow holders, in good faith, of a weapon to abandon it or save it for legal detention.check out our press release","{'Negative': 0.107531816, 'Neutral': 0.84651756, 'Positive': 0.045950603}"
Paris,crime in transport has fallen by % this year and by % since september. we will further strengthen our action to continue this momentum: nearly additional police and gendarmes in new services dedicated to transport safety.,"{'Negative': 0.008485572, 'Neutral': 0.27556872, 'Positive': 0.71594566}"
Paris,"| the homeless assistance brigade (bapsa) was created in after a harsh winter. the police officers of this brigade depend on the dspap, one of the directions of the whose motto is ""assist, serve and protect"".","{'Negative': 0.13127856, 'Neutral': 0.8087948, 'Positive': 0.05992658}"
Paris,"fake calendar sellers, real crooks! canvassers are trying to impersonate firefighters, police or public officials to sell you calendars door-to-door. have the right simple and effective reflexes to avoid the scam!","{'Negative': 0.8315047, 'Neutral': 0.15595558, 'Positive': 0.012539676}"
Paris,| last night the of the bac set up a surveillance device at . they then notice an individual with a suspicious attitude and proceed to check him.entry of: kg of cocaine the man was arrested,"{'Negative': 0.32070184, 'Neutral': 0.6593831, 'Positive': 0.019915007}"
Paris,"| during an identity check, following a security search at station, the discovered on an individual g heroin arrest","{'Negative': 0.11263315, 'Neutral': 0.86186916, 'Positive': 0.025497708}"
Paris,"from the th ci were requested by an elderly person who was the victim of a scam by an individual she designated on the street.the latter, pretending to be a banker, sought to recover the allegedly hacked from the victim: he was arrested.","{'Negative': 0.48151293, 'Neutral': 0.5034539, 'Positive': 0.015033165}"
Paris,"| yesterday, during discreet surveillance at the metro, men were seen during a narcotics transaction.the reacted immediately:2 arrests36 seized crack pebblesvisible or discreet presence, but total investment!","{'Negative': 0.34808147, 'Neutral': 0.58233285, 'Positive': 0.069585696}"
Paris,"after a complaint filed in in august for a theft committed in a gym locker room, the investigated and tracked down an individual who usurped identities to access sports complexes: thefts were able to be imputed. arrest detention","{'Negative': 0.62864107, 'Neutral': 0.35874358, 'Positive': 0.012615351}"
Paris,a surveillance device set up at allowed the to seize a large quantity of narcotics during a search kg of cannabis g of cocaine arrests,"{'Negative': 0.22669953, 'Neutral': 0.74233174, 'Positive': 0.03096871}"
Paris,"| ""beautiful as a truck... from !"".good week start !","{'Negative': 0.0018834204, 'Neutral': 0.015272097, 'Positive': 0.9828445}"
Paris,"republic square | in application of decree n -01358 limiting sound emissions in the context of protest rallies, the police officers of the dopc seized the sound equipment. verbalized organizer seized material","{'Negative': 0.53678393, 'Neutral': 0.44175294, 'Positive': 0.021463117}"
Paris,"at , the bac checked an individual following a traffic violation... and in possession of cannabis. arrest search: seizure of more than , ketamine, cocaine, mdma, cannabis, ecstasy, etc.","{'Negative': 0.39564398, 'Neutral': 0.5759715, 'Positive': 0.02838457}"
Paris,"day or night, our goal is to ensure your safety.last night, arrests were carried out by the in and for snatching on public roads. as a reminder, in case of emergency:","{'Negative': 0.11675568, 'Neutral': 0.7115938, 'Positive': 0.17165048}"
Paris,"behind the scenes of the police!sound, rehearsal, flags... many agents contribute to the preparation of the ceremonies. discover their work in music! the video on our youtube channel","{'Negative': 0.015765186, 'Neutral': 0.6402392, 'Positive': 0.34399572}"
Paris,"friday afternoon in , assisted by a canine crew carried out an operation in the common areas of an apartment building. the dog quickly marked in front of the door of an apartment: kg of cannabis seized arrest","{'Negative': 0.12235569, 'Neutral': 0.815499, 'Positive': 0.06214536}"
Paris,"the of the watch over people, but also over property.this night, several interventions following break-ins in , and : thanks to the responsiveness of the fdo arrests.","{'Negative': 0.081920534, 'Neutral': 0.7722515, 'Positive': 0.145828}"
Paris,"| are you starting to think about your shopping? a scam can surprise you when leaving the store:1 a fake commercial employee approaches you2 claiming a payment error, he hands you a cb terminal3 he runs away with yourwitness/victim","{'Negative': 0.77800876, 'Neutral': 0.21037154, 'Positive': 0.011619707}"
Paris,mobilization of the of the police station against burglaries: arrested facts solved,"{'Negative': 0.061746493, 'Neutral': 0.84118307, 'Positive': 0.09707045}"
Paris,"| are your taste buds quivering at the idea of tasting ?like all good things, this one should be eaten in moderation: don't put yourself in the red! choose public transport or designate a driver who will stay sober.","{'Negative': 0.18843083, 'Neutral': 0.61182946, 'Positive': 0.1997397}"
Paris,"shelter operation by the and the , boulevard de la chapelle in . isolated men were taken care of by state services and their partners. check out our press release","{'Negative': 0.025814973, 'Neutral': 0.85237324, 'Positive': 0.12181184}"
Paris,"operation yesterday in : during a check the local arrested individuals in possession of narcotics.after searching the home of one of the individuals: seizure of +1kg of cannabis, g of cocaine and heroin and in arrests","{'Negative': 0.3245805, 'Neutral': 0.6529092, 'Positive': 0.02251028}"
Paris,"the police officers in the inner suburbs are working hard ! arrests, +5kg of cannabis seized. arrest, +5.5kg of cannabis seized, g of cocaine and . arrest + g of cannabis seized.","{'Negative': 0.0842675, 'Neutral': 0.6085055, 'Positive': 0.3072271}"
Paris,the important thing is to see well but also to be seen despite the and the of the brightness . adapt your speed and respect safety distances mandatory retro-reflective vest at night outside agglomerationdon't forget your light equipment!,"{'Negative': 0.027473789, 'Neutral': 0.42791682, 'Positive': 0.5446094}"
Paris,"| sustained action by against traffic, day and night. over the past few hours: arrest and kg of cannabis seized with the help of municipal police arrests and g of cocaine seized","{'Negative': 0.32893145, 'Neutral': 0.6415136, 'Positive': 0.029554952}"
Paris,following the announcement of : presence reinforced at .over the past night: incidents arrests (group to commit violence and association of criminals) effectiveness of security provision in violence prevention,"{'Negative': 0.21849069, 'Neutral': 0.75029993, 'Positive': 0.03120939}"
Paris,"| what to do about racketeering? talk to your parents talk to your teachers if the racketeering takes place in schools if you're afraid to tell your loved ones, call in case of emergency:","{'Negative': 0.54670787, 'Neutral': 0.43876824, 'Positive': 0.014523903}"
Paris,"yesterday late afternoon, the were required for a phone extortion committed by three young individuals in .thanks to the responsiveness of the and the indications of the victim: the perpetrators were found and arrested.","{'Negative': 0.37539345, 'Neutral': 0.5995992, 'Positive': 0.025007386}"
Paris,"have you just received a text that says your ""new vital card is available"" with a link? don't fall for the trap, it might be a scamfollow the advice of to avoid a trap","{'Negative': 0.6817793, 'Neutral': 0.30270743, 'Positive': 0.015513273}"
Paris,"today, a video operator spotted young girls who had just stolen a metro user's credit card.arrived at the station in they tried to flee before being caught by the of the network teams: arrests.","{'Negative': 0.5857655, 'Neutral': 0.39531702, 'Positive': 0.018917497}"
Paris,"this morning in , the of the bac intervened in an apartment for a burglary in progress.they caught individuals in flagrante delicto. one of them tried to escape by jumping out of the window... before being arrested by a mountain bike crew: arrests.","{'Negative': 0.49994463, 'Neutral': 0.47202358, 'Positive': 0.02803179}"
Paris,call for projects !the interministerial fund for of and is intended to support the implementation of actions to prevent crime.it's up to you file to be submitted before /12,"{'Negative': 0.07151798, 'Neutral': 0.81237036, 'Positive': 0.1161116}"
Paris,| at the service of the population /7!good week to you all !,"{'Negative': 0.0017694711, 'Neutral': 0.051885877, 'Positive': 0.9463446}"
Paris,"in memory of the victims of the terrorist attacks committed on , , the prefect of police presided over the tribute ceremony under the , with the rekindling of the flame and a wreath laying at the tomb of the unknown soldier.","{'Negative': 0.32703272, 'Neutral': 0.6382908, 'Positive': 0.03467647}"
Paris,"at le carillon, le petit cambodge, la bonne bire, le comptoir voltaire, la casa nostra and la belle quipe, seven years later, our hearts go out to the victims of the attacks.'snever forget","{'Negative': 0.45371687, 'Neutral': 0.46916148, 'Positive': 0.07712169}"
Paris,"united in front of the bataclan, the tribute to all the victims of continues.'snever forget","{'Negative': 0.09602404, 'Neutral': 0.63976973, 'Positive': 0.2642063}"
Paris,"today, the commemorations begin at the where, on , during a tragic evening, terrorism struck the nation. the pays tribute to all the victims as well as to the security forces who intervened.'snever forget","{'Negative': 0.20268776, 'Neutral': 0.6128993, 'Positive': 0.18441293}"
Paris,": a long-standing work is being done on banding phenomena. it must be continued and insisted on the detection anda long-standing work is carried out on the phenomena of bands. it must be continued and insisted on upstream detection, which is fundamental. determination, responsiveness and vigilance of all actors.","{'Negative': 0.044423968, 'Neutral': 0.7469605, 'Positive': 0.20861544}"
Paris,solidarity and moved thoughts of the for its counterparts of the .,"{'Negative': 0.013786006, 'Neutral': 0.79413754, 'Positive': 0.19207647}"
Paris,"| presence of the prefect of police, , for the armistice commemoration ceremony during which the head of state, , rekindled the flame under the .in memory of our soldiers who died for france.","{'Negative': 0.11358562, 'Neutral': 0.78223735, 'Positive': 0.10417703}"
Paris,this is a police commissioner student and trainee badge. congratulations to those who have the right answer!,"{'Negative': 0.010902883, 'Neutral': 0.15099278, 'Positive': 0.8381043}"
Paris,"on this national anti-bullying day at school, let's say .mockery, bullying, humiliation, insults... harassment can take various forms and now goes beyond school gates with .","{'Negative': 0.854042, 'Neutral': 0.13776359, 'Positive': 0.008194362}"
Paris,"in , an operation to secure and fight was carried out in the abbey sector.the balance sheet is as follows people were checked kg of cannabis resin seized molotov cocktails discovered.","{'Negative': 0.1526991, 'Neutral': 0.8106412, 'Positive': 0.03665958}"
Paris,"traffic device set up today on the occasion of the demonstration declared by the inter-union urif cgt, fsu and solidaires. find our press release","{'Negative': 0.029595455, 'Neutral': 0.9290784, 'Positive': 0.041326113}"
Paris,| what rank does this chest badge correspond to? to your answers in comments student and trainee police commissioner2 divisional commissioner3 divisional commander,"{'Negative': 0.089494064, 'Neutral': 0.88734657, 'Positive': 0.02315935}"
Paris,"vigilance maintained | in , on a known deal point, the bac n arrested an individual, trying to flee, in possession of a large amount of narcotics g of cannabis g of cocaine arrest","{'Negative': 0.33684817, 'Neutral': 0.6417787, 'Positive': 0.021373097}"
Paris,"i crisis exercise in progress at roissy charles de gaulle airport . don't worry if you observe a strong deployment of police and rescue services, no incident is to be deplored..","{'Negative': 0.06263438, 'Neutral': 0.5258058, 'Positive': 0.41155988}"
Paris,"yesterday in , the of the csi75 checked a motorist whose insurance and license were false. a thorough search of the vehicle revealed packs of cigarettes (value to )2 arrests","{'Negative': 0.45826903, 'Neutral': 0.50725245, 'Positive': 0.03447854}"
Paris,"| here is an idea for an outing for your children:at , they are invited to lead and solve an investigation, based on learning technical and scientific police techniques. from to years old times and dates","{'Negative': 0.006838304, 'Neutral': 0.5683331, 'Positive': 0.4248286}"
Paris,"| the th quai des orfvres prize was awarded to jean-franois pasques for his novel ""fils de personne""!dive with commander julien delestran into the heart of an investigation into mysterious disappearances and suspicious death.","{'Negative': 0.017569713, 'Neutral': 0.7387038, 'Positive': 0.24372648}"
Paris,"in , the noticed the presence of a car that was skidding, while fleeing with excessive speed in the sight of the police. arrest for and endangering the lives of others. vehicle impounded.","{'Negative': 0.79457814, 'Neutral': 0.19408806, 'Positive': 0.011333757}"
Paris,"yesterday in , the wanted to control a vehicle that refused to comply, before hitting a wall. he fled on foot and then jumped into the canal. pulled out of the water by a team from the local bac, he was arrested. stolen vehicle arrest","{'Negative': 0.63064295, 'Neutral': 0.3513054, 'Positive': 0.018051708}"
Paris,"new alert system:if you are in an area of imminent danger, you will receive a notification with instructions to: take shelter prepare yourself inform you protect yourself info:","{'Negative': 0.18672507, 'Neutral': 0.7540812, 'Positive': 0.059193786}"
Paris,"| for more than years, a jury meets every year and judges the anonymized manuscripts of many authors, with a view to awarding the quai des orfvres prize. the next winner? tomorrow at p.m.!discover the history of the pqo","{'Negative': 0.035044886, 'Neutral': 0.8570753, 'Positive': 0.107879855}"
Paris,"| place in , after investigations, the police arrested a cocaine seller who had just made a transaction. the search of his home led to the discovery of kg of cocaine4,000","{'Negative': 0.37712404, 'Neutral': 0.5960911, 'Positive': 0.026784873}"
Paris,"| following a road check in , the arrested occupants of a vehicle in possession of: g. of cocaine g. amphetamines g. of heroin in cash arrests","{'Negative': 0.31832913, 'Neutral': 0.6648356, 'Positive': 0.016835297}"
Paris,| here's a good one this morning! have a nice week everyone!,"{'Negative': 0.001271128, 'Neutral': 0.008064454, 'Positive': 0.99066436}"
Paris,"| early this morning, four police officers returning home from duty witnessed a robbery.they chased the thief: arrest. bag and phone given to the victim.","{'Negative': 0.35431346, 'Neutral': 0.611219, 'Positive': 0.034467567}"
Paris,"in case of accident, discomfort, assault, theft... do you know the essential numbers to contact? these services are all available hours a day, days a week, and are at your disposal.","{'Negative': 0.09183927, 'Neutral': 0.73232067, 'Positive': 0.17584005}"
Paris,summary of operations carried out since june : kg of goods seized people evicted verbalizations pv for street sale arrests,"{'Negative': 0.4305653, 'Neutral': 0.55824405, 'Positive': 0.011190683}"
Paris,the commitment of law enforcement sectors continues: reinforced presence on public roads and in public transport to fight against all forms of delinquency and challenge offenders,"{'Negative': 0.036179457, 'Neutral': 0.68711764, 'Positive': 0.27670288}"
Paris,"the objective of the security operations carried out in the sectors? ensure the tranquility and safety of residents, traders and tourists: street sales and gambling unapproved vehicles","{'Negative': 0.09250925, 'Neutral': 0.808286, 'Positive': 0.099204674}"
Paris,the prefect of police was at the end of the day alongside the women and the men who are mobilized daily to secure the sectors.the seasons pass but the mobilization does not weaken!,"{'Negative': 0.047601797, 'Neutral': 0.6540353, 'Positive': 0.29836297}"
Paris,services are ready to host the match !,"{'Negative': 0.008135318, 'Neutral': 0.45588854, 'Positive': 0.5359761}"
Paris,"do you travel by bicycle? you will have noticed, since the time change, the brightness has decreased sharply at the start of autumn!make sure you are visible throughout the day thanks to several mandatory equipment and others highly recommended!","{'Negative': 0.07010676, 'Neutral': 0.4709913, 'Positive': 0.45890185}"
Paris,"| yesterday in , the bac police checked a suspicious man: grams of cocaine found in his possession the man was arrested","{'Negative': 0.33810204, 'Neutral': 0.63415104, 'Positive': 0.027746921}"
Paris,"don't drop your in the mailbox: this imprudence makes it easier for burglars! on wednesday, investigators from the police station identified and arrested the author of a theft who recovered the keys to the home. he was imprisoned.","{'Negative': 0.47788757, 'Neutral': 0.44622996, 'Positive': 0.075882405}"
Paris,"installation of a security device for the rugby match saturday /11 at . to anticipate your journeys by public transport, consult the dedicated sncf page: for more info, see the press release","{'Negative': 0.042769574, 'Neutral': 0.91506684, 'Positive': 0.0421636}"
Paris,"| last night in , the tried to control a vehicle that had committed traffic violations.the driver refused to comply. stuck in traffic, he was arrested. seizure of kg of cannabis.","{'Negative': 0.77585167, 'Neutral': 0.21331541, 'Positive': 0.010832908}"
Paris,"| van gogh, monet or soulages, the works of these great painters sometimes cross paths with investigators from the famous brb art theft repression group! to your headphones","{'Negative': 0.032143813, 'Neutral': 0.7396228, 'Positive': 0.22823337}"
Paris,"yesterday at the end of the afternoon in the local police officers were required for a burglary in progress in a pavilion.after a quick and discreet progression in the accommodation, they arrested the thieves in the act! arrests","{'Negative': 0.30196905, 'Neutral': 0.6165319, 'Positive': 0.08149904}"
Paris,"operation ""point of deal"" carried out this morning in :the police seized grams of cocaine hidden in the common areas of an apartment building.investigation or flagrante delicto: the fight is daily!","{'Negative': 0.43159533, 'Neutral': 0.50135857, 'Positive': 0.067046076}"
Paris,"| day and night, the police officers of the are mobilized to secure the surroundings of the and fight against all forms of delinquency.","{'Negative': 0.09417686, 'Neutral': 0.8045618, 'Positive': 0.10126137}"
Paris,"| today, police on patrol in public transport arrested two individuals in possession of crack, gare du nord and jaurs metro:in total : seized crack pebbles","{'Negative': 0.31436738, 'Neutral': 0.6515221, 'Positive': 0.034110434}"
Paris,"yesterday in and , two great cases were carried out by the local following discreet surveillance and a chase with an individual who has multiplied traffic violations: arrests in total +6kg of cannabis seized","{'Negative': 0.0931624, 'Neutral': 0.552742, 'Positive': 0.35409558}"
Paris,| here is the most popular photo this month on the instagram account!parisians will necessarily recognize the place! join us,"{'Negative': 0.0011738894, 'Neutral': 0.04181893, 'Positive': 0.95700717}"
Paris,"| this afternoon, on the lawn of reuilly in , several individuals engaged in motorcycle rodeo, in defiance of the safety of walkers.thanks to the responsiveness and perfect coordination of the involved: arrests motorcycle seized","{'Negative': 0.21587032, 'Neutral': 0.6191934, 'Positive': 0.16493624}"
Paris,"in a few days the winner of the quai des orfvres prize will be known! each year, a french detective novel is crowned by a jury of around twenty personalities. see you on tuesday, november to find out the big winner of !","{'Negative': 0.0038733413, 'Neutral': 0.49305394, 'Positive': 0.5030727}"
Paris,"| last night in , the local bac , then under discreet surveillance, arrested a dealer who was trying to flee to an apartment and get rid of a g bag of cannabis.after search: additional g seized + .","{'Negative': 0.2987969, 'Neutral': 0.6779251, 'Positive': 0.023278022}"
Paris,objectives: prevent public order disturbances and fight crime.assessment: % of urban violence phenomena observed arrests thanks to the determined action of law enforcement.,"{'Negative': 0.11767923, 'Neutral': 0.7691839, 'Positive': 0.113136865}"
Paris,"| in accordance with the instructions of the minister of the interior , and under the authority of the prefect of police , an important police system has been put in place in the paris area.","{'Negative': 0.014423881, 'Neutral': 0.7379175, 'Positive': 0.24765864}"
Paris,"| have you just received a message from a video platform informing you of a payment default?be careful, this may be a scam, used by scammers via fake websites.all tips","{'Negative': 0.8053228, 'Neutral': 0.18406165, 'Positive': 0.010615541}"
Paris,| results of the police operation carried out last night in the old quarries of paris: people checked and fined for entry and traffic prohibited in these places. reminder: access to the catacombs is dangerous and forbidden.,"{'Negative': 0.7775612, 'Neutral': 0.21303724, 'Positive': 0.009401499}"
Paris,"on this evening, and like every evening, the are patrolling paris and in the small crown.the objective is to ensure your safety: on public transport and everywhere on the public roadmore details in our press release","{'Negative': 0.020846505, 'Neutral': 0.7092134, 'Positive': 0.26994014}"
Paris,| only a few days left to register for the police commissioner contest. registration closing date - discover the terms,"{'Negative': 0.056924503, 'Neutral': 0.896957, 'Positive': 0.04611849}"
Paris,"last night at , the arrested an individual on a scooter who had just committed a traffic violation.in possession of g of crack, his home was then searched: entry of +1,600 in and mobile phones the investigation continues","{'Negative': 0.45800394, 'Neutral': 0.5187879, 'Positive': 0.023208164}"
Paris,"at the metro station in , the of the brf arrested a man who had just stolen a user's cell phone. the victim was not injured and filed a complaint. arrest for pickpocketing.","{'Negative': 0.49591362, 'Neutral': 0.453441, 'Positive': 0.050645407}"
Paris,actions are taken daily against crack in paris by the .goals : prevent rebuilding of open scenes dismantle networks and challenge traffickersfind my interview on,"{'Negative': 0.35767934, 'Neutral': 0.62088424, 'Positive': 0.021436444}"
Paris,the olympic games are getting ready today. the minister of the interior gave me a roadmap and the services of the are now investing to welcome athletes and tourists during this event.,"{'Negative': 0.0051829405, 'Neutral': 0.35216287, 'Positive': 0.64265424}"
Paris,"| ""circulate! the police headquarters at the service of mobility.""new exhibition dedicated to the different means of transport and the evolution of the parisian urban landscape at the museum!come and visit us soon","{'Negative': 0.0027346483, 'Neutral': 0.3369609, 'Positive': 0.6603044}"
Paris,"required for possible violence against an animal in a home in , the immediately moved and noticed the presence of a dead dog. the individual was arrested for an act of cruelty. the remains of the animal have been taken care of.","{'Negative': 0.785769, 'Neutral': 0.20638473, 'Positive': 0.007846225}"
Paris,"ensuring everyone's safety is our priority. last night, in and , the arrested individuals practicing , endangering the lives of pedestrians. arrests vehicles seized","{'Negative': 0.65272343, 'Neutral': 0.31689548, 'Positive': 0.030381087}"
Paris,"don't get caught out! tonight takes place on , at a.m. it will be a.m. this has a direct impact on the brightness and your visibility when you are riding on two wheels or on a scooter: remember to check the proper functioning of your lights.","{'Negative': 0.22066337, 'Neutral': 0.6525779, 'Positive': 0.12675875}"
Paris,"last night at , the from the local bac arrested two individuals who had just violently stolen a luxury watch from a man in the lobby of his building. arrests watch recovered","{'Negative': 0.5765557, 'Neutral': 0.40284827, 'Positive': 0.020596042}"
Paris,"the maintain their vigilance in the fight against the dangerous practice of . yesterday in and , two individuals, without helmets, were arrested on the public highway: motorcycles seized","{'Negative': 0.54478925, 'Neutral': 0.43741807, 'Positive': 0.017792685}"
Paris,"on a fight operation, the of the canine company stopped in front of an apartment in . the raided him and discovered a sports bag containing kg of cannabis defendants arrested.","{'Negative': 0.3042825, 'Neutral': 0.67046213, 'Positive': 0.025255367}"
