user,senti_text_processed,sentimenal_res
Paris,"world sign language day | at the , our agents can train in sign language for better care of witnesses and victims.an emergency, contact (deaf and hard of hearing emergency number)","{'Negative': 0.04713294, 'Neutral': 0.72144216, 'Positive': 0.23142481}"
Paris,[ of personal data ] provides on its site with an electronic letter produced by the of and of ://,"{'Negative': 0.04068262, 'Neutral': 0.92539525, 'Positive': 0.03392212}"
Paris,"last night in the th arrondissement, the of the were called for the theft of a necklace committed with violence.in the company of the victim, they then surveyed the area in order to find the perpetrators who could be spotted minutes later: arrests.","{'Negative': 0.55196595, 'Neutral': 0.43489188, 'Positive': 0.013142164}"
Paris,| think of your heart but also that of others! download the app that maps heart defibrillators around you! save precious time for rescue with a victim in cardiac arrest!,"{'Negative': 0.04238877, 'Neutral': 0.42490914, 'Positive': 0.532702}"
Paris,"| yesterday, near the gardens of ole , the under surveillance arrested individuals involved in drug trafficking.after search and seizure of: g crack g of cocaine g of cutting products kg baking soda","{'Negative': 0.38457692, 'Neutral': 0.5963532, 'Positive': 0.019069903}"
Paris,"last night in , the local , wanting to carry out an check, saw two individuals fleeing as they approached, plastic bag in hand.the pursuit will not have been long: arrests. seizure of +1.5 kg of cannabis and .investigation in progress.","{'Negative': 0.2783099, 'Neutral': 0.65407807, 'Positive': 0.06761201}"
Paris,situation around the jardin d'ole. check out the prefect of police's press release,"{'Negative': 0.08071271, 'Neutral': 0.8832481, 'Positive': 0.0360392}"
Paris,"last night in , a man fled at the sight of the , getting rid of a phone.his control then reveals... a ""police"" armband and a radio.at the same time, a phone theft by a fake policeman is reported: arrest.","{'Negative': 0.72296345, 'Neutral': 0.257546, 'Positive': 0.019490492}"
Paris,"last night, in , two individuals fled hastily at the sight of the police... by getting rid of a bag whose contents left little doubt about their nocturnal activities: arrests. seizure of +2.2 kg of cannabis.","{'Negative': 0.32367203, 'Neutral': 0.6258038, 'Positive': 0.050524145}"
Paris,"a video, showing an arrest made by police in the th arrondissement of paris, is currently circulating on social networks. the prefect of police opens an administrative investigation.","{'Negative': 0.14885321, 'Neutral': 0.81078815, 'Positive': 0.040358674}"
Paris,the prefect of police seized the igpn so that an administrative investigation be carried out on these facts.,"{'Negative': 0.22744602, 'Neutral': 0.7494884, 'Positive': 0.023065537}"
Paris,| registrations for external and internal competitions on access tests to the body of deminers are open! deadline: /11/2021discover the terms,"{'Negative': 0.012873752, 'Neutral': 0.8670223, 'Positive': 0.120103985}"
Paris,"the daily life of ? fight crime in all its forms.yesterday, montparnasse station, a woman was the victim of the theft of her by individuals who had noted her code... spun by the of the they were able to be caught: arrests","{'Negative': 0.57195014, 'Neutral': 0.40721756, 'Positive': 0.020832328}"
Paris,"a video, showing an arrest by the police at , is circulating on social networks. an administrative investigation is open.","{'Negative': 0.12594666, 'Neutral': 0.82232666, 'Positive': 0.051726688}"
Paris,| have you resumed your good habits at the office to work?follow the advice of ! practical sheets will allow you to defeat hacking attempts and protect your data.all information,"{'Negative': 0.03869748, 'Neutral': 0.58044714, 'Positive': 0.38085535}"
Paris,| victim or witness of ?let nothing pass: call in the face of harassment call against cyberbullyingmore information at:,"{'Negative': 0.4537251, 'Neutral': 0.53116393, 'Positive': 0.015110938}"
Paris,"| in years of existence, the have never failed in their motto: ""save or perish"".the unfailing commitment of these soldiers for the population of paris and the inner suburbs was honored during a ceremony at the invalides.","{'Negative': 0.015790865, 'Neutral': 0.3283898, 'Positive': 0.65581936}"
Paris,"| years ago, by imperial decree of september , , the prestigious institution of was created to reorganize and professionalize the fight against fire in paris.military ceremony at the invalides to follow live on facebook at :30 p.m.","{'Negative': 0.02975964, 'Neutral': 0.92374504, 'Positive': 0.046495326}"
Paris,"on the occasion of the this weekend, the offers you days of visits and entertainment. grand premiere with a commented and theatrical visit of the louis lpine and clestin hennion exhibition!registrations, info","{'Negative': 0.002210916, 'Neutral': 0.31617072, 'Positive': 0.68161833}"
Paris,the whole joins with sadness in the pain of the following the disappearance of one of his own.support for his family and his brothers in arms.,"{'Negative': 0.6176179, 'Neutral': 0.3457176, 'Positive': 0.03666452}"
Paris,"last night, , individuals armed with a handgun violently stole a delivery man's scooter.1st perpetrator controlled by the victim and taken care of by the police2nd alleged suspect arrested later in the evening scooter found!","{'Negative': 0.835058, 'Neutral': 0.15707411, 'Positive': 0.007867937}"
Paris,"did you enjoy our st ""immersion"" video in the rescue police with ? but by the way, who is she really? why the police? his best business? her favorite book?find out in our new video","{'Negative': 0.052236028, 'Neutral': 0.6936863, 'Positive': 0.25407764}"
Paris,"strong support for on this day of homage to pierre-franois bonnard, on-board engineer for civil security, who died on while on his way to a mountain rescue operation.special thoughts to his family and colleagues.","{'Negative': 0.048661835, 'Neutral': 0.39962497, 'Positive': 0.55171317}"
Paris,double blow for the bac in last night!the noticed an individual pushing an unregistered cross bike inside a box. result ? motorcycle declared stolen inside the box: cannabis and cocaine arrests,"{'Negative': 0.7478192, 'Neutral': 0.2392356, 'Positive': 0.012945244}"
Paris,"| ""assist, serve and protect""","{'Negative': 0.049041, 'Neutral': 0.7794922, 'Positive': 0.17146686}"
Paris,"reaction action for the of the bac yesterday afternoon at they quickly spotted individuals following a woman and a child. at a bend in the street, the group violently tried to steal his watch. arrestssupport for police officers slightly injured.","{'Negative': 0.80901206, 'Neutral': 0.1825349, 'Positive': 0.008453006}"
Paris,| saturday september at :30 p.m. and sunday september at p.m. and p.m. pp museum at national identity card has celebrated its th anniversary! but how has it evolved over time? registration,"{'Negative': 0.0024055087, 'Neutral': 0.43636596, 'Positive': 0.5612285}"
Paris,"| saturday and sunday september at :30 a.m., :30 p.m. and p.m. pp museum at the legacy of louis lpine and clestin hennion during a guided tour... but also dramatized!registration","{'Negative': 0.0041509266, 'Neutral': 0.81918544, 'Positive': 0.17666371}"
Paris,| saturday and sunday september at :30 a.m. pp museum at at the museum: will you be able to solve the investigation?survey offered to children from to years old on registration!,"{'Negative': 0.031610306, 'Neutral': 0.8203381, 'Positive': 0.14805168}"
Paris,| saturday september from :30 a.m. to :30 p.m. le pr saint-gervaiscome and discover the treasures kept by the archives of the which opens its doors to the public for the first time!remember to register!,"{'Negative': 0.0024889694, 'Neutral': 0.39501634, 'Positive': 0.6024947}"
Paris,"| are fast approaching!see you this weekend, september and !a little preview of what will be offered to you at the ? ask for the program! all information:","{'Negative': 0.003558375, 'Neutral': 0.76598567, 'Positive': 0.2304559}"
Paris,"budget, training, complaint filing, etc. find the report of the in the thread of","{'Negative': 0.080290705, 'Neutral': 0.8899306, 'Positive': 0.029778665}"
Paris,"yesterday morning, a woman was the victim of a robbery in the corridors of a station in . slightly injured victim taken to hospital alleged author arrested a few hours later thanks to the perseverance of a brf video operator","{'Negative': 0.25825015, 'Neutral': 0.6704195, 'Positive': 0.071330294}"
Paris,live | beauvau security fence from roubaix.,"{'Negative': 0.052600786, 'Neutral': 0.8737053, 'Positive': 0.073693894}"
Paris,| a successful start to the school year remains one of the key points to move forward with a light spirit in your studies. adopt an efficient working method and put the odds on your side. cannabis use alters brain capacity.,"{'Negative': 0.009040253, 'Neutral': 0.19416687, 'Positive': 0.79679286}"
Paris,scam | have you received an email regarding a fraud suspicion investigation? do not answer report on pharos:,"{'Negative': 0.80610883, 'Neutral': 0.18695039, 'Positive': 0.0069408063}"
Paris,tenacity in the fight in paris and in the inner suburbs.following a check at : nearly kg of cannabis and several thousand arrestduring a surveillance operation in : + kg of cannabis arrest,"{'Negative': 0.13847607, 'Neutral': 0.8268371, 'Positive': 0.034686834}"
Paris,| anyone likely to provide information relevant to the investigation can contact the general staff of the paris judicial police: pppj-appelatemoin.gouv.fr,"{'Negative': 0.04660572, 'Neutral': 0.9188756, 'Positive': 0.03451877}"
Paris,"| registrations for the commissioner and police officer competitions are open until october , .discover the terms","{'Negative': 0.028015468, 'Neutral': 0.9244832, 'Positive': 0.04750134}"
Paris,"- event alert: intervention in progress on the national bridge in , no risk of collapse.avoid the area and do not clutter emergency lines unnecessarily.residents, be careful.","{'Negative': 0.17627037, 'Neutral': 0.68484724, 'Positive': 0.13888241}"
Paris,fire in progress under the national bridge in .the are intervening with the security forces.traffic is cut off: on deck on the porte de bercy interchange in both directions,"{'Negative': 0.36364317, 'Neutral': 0.6083536, 'Positive': 0.028003165}"
Paris,"synchronization between the pp and the municipal police yesterday in the latter witnessed, via the video surveillance cameras, a robbery with violence and reported it.on the spot : victim taken to hospital by arrest by the dspap","{'Negative': 0.47808173, 'Neutral': 0.50345427, 'Positive': 0.018463992}"
Paris,i extend my condolences to the family and colleagues of the civil security mechanic who died in the accident of a helicopter going into intervention with people on board. all my support to the big family of civil security and mountain rescue,"{'Negative': 0.2702152, 'Neutral': 0.56400704, 'Positive': 0.16577776}"
Paris,"the literary back to school is also done on the side of the ! discover the book ""a cop in the mist"" by rmy borel, police commander, which traces the day of a police inspector, june , .interview and info on the blog","{'Negative': 0.031157665, 'Neutral': 0.888356, 'Positive': 0.08048633}"
Paris,"thursday in , a -year-old child climbed a parapet, m high, after an argument in his school. several went immediately to the spot. fearing that he would fall or jump, one of the policemen managed to reach the child and put him to safety.","{'Negative': 0.3264294, 'Neutral': 0.6121228, 'Positive': 0.06144774}"
Paris,"last night, in , individual, carrying a pickaxe, was walking down the street while degrading vehicles and shop windows. following a call, the local bac spotted the suspect and arrested him in possession of the construction tool.","{'Negative': 0.6741645, 'Neutral': 0.3148389, 'Positive': 0.010996666}"
Paris,"| thank you to all the police, firefighters and gendarmes mobilized throughout this day for the supervision of the demonstrations.","{'Negative': 0.012227701, 'Neutral': 0.17351872, 'Positive': 0.81425357}"
Paris,"| people who wish to leave the demonstrations arriving at the palais royal can do so by taking the access to the metro as well as rue saint-honor, to the east.","{'Negative': 0.036823556, 'Neutral': 0.9126042, 'Positive': 0.05057218}"
Paris,"dismantling of a crack trafficking network in the areas of and the gardens of .surveillance, spinning... people were arrested thanks to the stubborn work of the of the th dpj during months of investigations! the investigation continues.","{'Negative': 0.33038878, 'Neutral': 0.60013396, 'Positive': 0.06947725}"
Paris,"| required by a woman attacked by men who had just snatched her necklace, the of the bac of quickly arrested, helped by their precise report, the alleged thieves.2 arrestscomplaint filedcollier returned","{'Negative': 0.49652427, 'Neutral': 0.48156986, 'Positive': 0.0219059}"
Paris,"from theory to practice, all in one place!presentation then demonstration of the bri for students of the public policy master of .the goal? prepare them for acts of potential hostage taking on their future position.","{'Negative': 0.062372763, 'Neutral': 0.8569069, 'Positive': 0.08072029}"
Paris,"on , | ""i am proud to have participated in the investigation, for the victims.""mathieu, criminal investigator at the nd dpj, spent the night at the bataclan alongside his colleagues to find all the clues.","{'Negative': 0.029385727, 'Neutral': 0.38994345, 'Positive': 0.58067083}"
Paris,"episode n1 of the podcast ""les voix de la pp"", discover the mystery of the bloody stone... and the secret ingredient of an extraordinary pt. every friday, exclusive content on our youtube channel, don't hesitate to subscribe","{'Negative': 0.002935657, 'Neutral': 0.25571033, 'Positive': 0.74135405}"
Paris,"placed in police custody, her husband was referred and sentenced to months suspended imprisonment.the police are fully mobilized against domestic and intra-family violence. you are not alone, dare to cross the doors of the police station.in case of emergency: /2","{'Negative': 0.35804123, 'Neutral': 0.5844227, 'Positive': 0.057536095}"
Paris,"| a woman victim of domestic violence came to the police station. the police officer in charge of taking complaints established a relationship of trust, allowing the victim to denounce the recurrence of the facts.1/2","{'Negative': 0.23389843, 'Neutral': 0.71331674, 'Positive': 0.05278489}"
Paris,"new good deal from the dspap in the fight against street sales with the dismantling of a supply chain for fruits and vegetables sold in and .4 arrests by the of the rescue and counterfeit brigade, assisted by the btc.","{'Negative': 0.025964009, 'Neutral': 0.38016796, 'Positive': 0.593868}"
Paris,"nitrous oxide, otherwise known as ""laughing gas"" is actually not that funny! its misuse presents many risks!yesterday in , it was following a check that the were able to seize nearly bottles of this gas.3 arrests","{'Negative': 0.92023456, 'Neutral': 0.07229967, 'Positive': 0.007465734}"
Paris,"on , | ""i would like to meet the bis guys.""this interview will have been the starting point for a personal and collective reconstruction.crossed stories of hostages and policemen united today by an incredible friendship.","{'Negative': 0.004437187, 'Neutral': 0.102115944, 'Positive': 0.8934468}"
Paris,a photo concerning the non-regulatory wearing of a police crest is currently circulating on social networks: an administrative investigation has been opened. disciplinary proceedings will be initiated.,"{'Negative': 0.3163189, 'Neutral': 0.6589463, 'Positive': 0.024734827}"
Paris,"| here's one of august's most popular instagram snaps! from august th to th, six european police officers patrolled with the of the dspap! don't miss the next new shots","{'Negative': 0.0015637943, 'Neutral': 0.07311825, 'Positive': 0.925318}"
Paris,"daily involvement against street sales and the resulting nuisances!yesterday afternoon in , thanks to the intervention of the of the dspap: seizure of more than cartridges of counterfeit cigarettes and more than euros arrest","{'Negative': 0.25477374, 'Neutral': 0.66860455, 'Positive': 0.076621756}"
Paris,national tribute ceremony to jean-paul belmondo on thursday september at the htel national des invalides.check out our press release and our plans.,"{'Negative': 0.021454716, 'Neutral': 0.8677352, 'Positive': 0.1108101}"
Paris,| risk of at the end of the day and tonight in le-de-france. the calls on ile-de-france residents to be vigilant.,"{'Negative': 0.22782923, 'Neutral': 0.7408528, 'Positive': 0.031317897}"
Paris,"on , | ""get as many victims to safety as possible, get them taken care of as quickly as possible.""denis safran, head doctor of the research and intervention brigade (bri), was the first doctor to join the bataclan.","{'Negative': 0.069009796, 'Neutral': 0.8132871, 'Positive': 0.11770316}"
Paris,"beginning of the trial of the attacks | exceptional mobilization of to secure the surroundings of the courthouse. the prefect of police, didier lallement, went to the site this morning, to meet the police and gendarmes involved in the system.","{'Negative': 0.07437935, 'Neutral': 0.877025, 'Positive': 0.048595645}"
Paris,"| faced with flights of false quality, remain vigilant! seasoned criminals can come to your home under a false identity (fake police, fake plumbers, etc.) to steal your money, credit cards or jewellery. in doubt, demand a professional card!","{'Negative': 0.8149092, 'Neutral': 0.17509593, 'Positive': 0.0099948505}"
Paris,"|attention, fake emails / invitations from the brigade for the protection of minors (bpm) have been identified by many internet users.ne reply and do not relay to these emailsstay informed of the steps to follow with ://","{'Negative': 0.6981677, 'Neutral': 0.28750518, 'Positive': 0.014327105}"
Paris,"on | ""in these cases, you can be both a rescuer and a victim.""from terraces to the bataclan via submerged call centers, will be mobilized that evening.","{'Negative': 0.09120932, 'Neutral': 0.8582593, 'Positive': 0.050531365}"
Paris,"the banditry repression brigade (brb), responsible for the investigation by the public prosecutor's office.","{'Negative': 0.4138986, 'Neutral': 0.5718018, 'Positive': 0.014299652}"
Paris,reactivity of the police officers of the on the robbery of a jewelry store on place vendme. two alleged perpetrators arrested nd dpj seizure of the survey,"{'Negative': 0.47371548, 'Neutral': 0.5119875, 'Positive': 0.014297005}"
Paris,"| he (or she) may have gun eyes, beware of who is hiding behind the screen on dating apps. instead of finding love, you could fall prey to fraudsters and romance scams.","{'Negative': 0.80312055, 'Neutral': 0.18522991, 'Positive': 0.011649439}"
Paris,| have you been the victim of the theft of one of your goods and have you just found it for sale on the internet? do not intervene on your own initiative. contact the police station you filed a complaint with.,"{'Negative': 0.8090376, 'Neutral': 0.18249597, 'Positive': 0.008466449}"
Paris,"| victim of a sound electric theft in , a person noticed his presence on an announcement via the internet. she asked the who set up a device and proceeded to the arrest of the presumed receivers during the meeting.bike found","{'Negative': 0.3276806, 'Neutral': 0.6501985, 'Positive': 0.022120869}"
Paris,"interviewed in liaisons in , he said his admiration for the police and in particular for the anti-gang.chao the artist!","{'Negative': 0.017886229, 'Neutral': 0.38675448, 'Positive': 0.5953592}"
Paris,"a great movie cop has just passed away. hero of successful films and king of the stunt, jean-paul had aroused many vocations for the police profession. the pays tribute to the magnificent of french cinema","{'Negative': 0.050374493, 'Neutral': 0.3244885, 'Positive': 0.625137}"
Paris,"on | ""everyone was ready to say to themselves: if necessary, i will not come back""on november , , bri operators entered the bataclan to save the hostages. an intervention that will forever mark their life as a police officer.","{'Negative': 0.16599904, 'Neutral': 0.71349514, 'Positive': 0.12050582}"
Paris,"a video, showing a police intervention in a parisian shopping center, caused a lot of reaction on social networks.here are some decryption elements","{'Negative': 0.37366417, 'Neutral': 0.5811536, 'Positive': 0.04518227}"
Paris,"| preventing, identifying and acting against sexual violence against minors online is the objective of the association! how?by empowering young people on their digital uses through educational comics","{'Negative': 0.061353564, 'Neutral': 0.7181829, 'Positive': 0.22046357}"
Paris,"last night, a passerby told the of the city security company ( headquarters) that a woman had just been attacked.they immediately went to the scene: arrests victim taken to hospital by","{'Negative': 0.5678452, 'Neutral': 0.41561538, 'Positive': 0.016539427}"
Paris,your phone only rings once and the number that appears is unknown?the goal? encourage you to call back the number that is surcharged. this is called the .what are the good reflexes?,"{'Negative': 0.25114152, 'Neutral': 0.55712104, 'Positive': 0.19173752}"
Paris,"| the fight daily against drug trafficking.yesterday afternoon, on patrol or securing in , and , the of the dspap have: seized heroin, cannabis and ecstasy arrested people","{'Negative': 0.31672147, 'Neutral': 0.64158577, 'Positive': 0.0416928}"
Paris,people who wish to leave the demonstration bound for can do so by taking the streets: rocket from lyon faubourg saint-antoine the metro,"{'Negative': 0.040279698, 'Neutral': 0.89479697, 'Positive': 0.06492337}"
Paris,"the main mission of the police? ensure the safety of people but also of property!thanks to their responsiveness: arrests in the past few hours for burglary in , and .","{'Negative': 0.03451503, 'Neutral': 0.40327713, 'Positive': 0.5622078}"
Paris,"establishment of a security perimeter around the palais de justice during the trial of the attacks of november , , which will begin on september .see our press release.","{'Negative': 0.07232431, 'Neutral': 0.9001389, 'Positive': 0.02753681}"
Paris,"for this first immersion video, dive with into the heart of a police-secours crew!the full video!","{'Negative': 0.024061456, 'Neutral': 0.6789256, 'Positive': 0.297013}"
Paris,"| our first youtube video ""in immersion | police rescue"" comes out tomorrow at pm! subscribe to our channel and activate the bell so you don't miss it!","{'Negative': 0.0018633972, 'Neutral': 0.19006577, 'Positive': 0.8080709}"
Paris,"for this , the wishes a good return to school to all schoolchildren, teachers, and school staff in which, all year round, prevention actions are carried out by . happy back to school everyone!","{'Negative': 0.002692302, 'Neutral': 0.04157176, 'Positive': 0.9557359}"
Paris,"| the prefect of police didier lallement proceeded this afternoon to a wreath laying, in the cemetery of , in memory of charles luizet, prefect of police at the liberation, in the presence of veterans and resistance fighters of and by .","{'Negative': 0.03236096, 'Neutral': 0.9202222, 'Positive': 0.04741671}"
Paris,"are you passionate about the great criminal stories, the journeys of seasoned investigators?that's good, we have material at ! every friday, find new content on our youtube channel. st podcast very soon!","{'Negative': 0.0022808062, 'Neutral': 0.04955215, 'Positive': 0.948167}"
Paris,"great synergy of services in the fight.local police officers, from the csi75 and the canine brigade made a good seizure during an operation carried out yesterday in : + kg of cannabis and stolen vehicle arrest","{'Negative': 0.009666447, 'Neutral': 0.1387414, 'Positive': 0.8515921}"
Paris,"positive monitoring device for the police yesterday afternoon in !they intervened after having noted transactions and identified the various protagonists. seizure of more than kg of cannabis, cocaine, more than arrests","{'Negative': 0.048368983, 'Neutral': 0.67253286, 'Positive': 0.27909815}"
Paris,"constant mobilization of in the fight . at , a police device identified a crack seller and his buyer. were discovered: crack + k packaging material arrests by the transport police","{'Negative': 0.19115572, 'Neutral': 0.76900625, 'Positive': 0.039838005}"
Paris,it's (already) back to school and some of you will probably go to work or school by bike! you know ? many stolen bicycles cannot be returned due to lack of identification. mark your property with an approved operator !,"{'Negative': 0.5858014, 'Neutral': 0.3556387, 'Positive': 0.05855992}"
Paris,"nice deal in for the of the bac!the trigger? a strong smell of cannabis detected in front of a pavilion.search hundred feet of cannabis, cannabis grass heads and packaging bags. arrests","{'Negative': 0.28754357, 'Neutral': 0.5339501, 'Positive': 0.17850636}"
Paris,"last night in , passers-by were attacked by individuals with broken bottles. a few minutes earlier, this same group stole a woman's bag.armed with their description, the found the alleged perpetrators: arrests","{'Negative': 0.833633, 'Neutral': 0.15876527, 'Positive': 0.0076017748}"
Paris,":30 am, gets up to take her service... well, not quite. not quite ? answer friday! new video every friday on our youtube channel. this september : episode ""in immersion"" in a service !","{'Negative': 0.038601406, 'Neutral': 0.754129, 'Positive': 0.20726961}"
Paris,"yesterday morning, from the , on patrol, noticed suspicious individuals whom they decided to follow discreetly. it was good for them since a few minutes later one of the individuals snatched the from a user when the metro doors closed: arrests","{'Negative': 0.07504142, 'Neutral': 0.4283984, 'Positive': 0.49656022}"
