user,senti_text_processed,sentimenal_res
Paris,"| head of security at the in the th century, vidocq hunts down criminals and assassins in a capital very different from the one we know...listen to the nd episode on youtube and on all listening platforms","{'Negative': 0.26739475, 'Neutral': 0.66091627, 'Positive': 0.07168902}"
Paris,"last night in , local were setting up surveillance after spotting people matching the report of a group of thieves.shortly after, the latter snatched a woman's handbag: arrests bag recovered and uninjured victim","{'Negative': 0.64488935, 'Neutral': 0.3374387, 'Positive': 0.017671898}"
Paris,"in le-saint-denisn tuesday, a dealer arrested by btc tried to flee. a nd official intervened to assist his colleague in difficulty. +4 people arrested while trying to create a crowd.","{'Negative': 0.5967826, 'Neutral': 0.38815925, 'Positive': 0.015058141}"
Paris,"| strong winds to come on le-de-france, follow the advice of !","{'Negative': 0.022629956, 'Neutral': 0.8679983, 'Positive': 0.109371796}"
Paris,"| pairs always pleasant to see evolve in the streets of paris: the police officers of the equestrian brigade and their mounts. for more unseen photos, visit our instagram account!","{'Negative': 0.0035901952, 'Neutral': 0.12392195, 'Positive': 0.8724879}"
Paris,| you want to vote but you will be absent on april and ? that's not a problem: it's not yet too late to make your power of attorney request!,"{'Negative': 0.13294445, 'Neutral': 0.59789044, 'Positive': 0.2691651}"
Paris,filming or taking a photo of a road accident while driving: an act that is unfortunately far from being marginal! the risk? create an accident and put his life and that of others in danger!reminder: + = + withdrawal of points.,"{'Negative': 0.92117894, 'Neutral': 0.07239917, 'Positive': 0.006421865}"
Paris,"the sustained action of the of the dspap against drug trafficking leads to very beautiful seizures!yesterday, following a search conducted at : kg of cannabis + more than cartridges of different calibers arrest","{'Negative': 0.020694602, 'Neutral': 0.32287958, 'Positive': 0.65642583}"
Paris,| do you receive a call from an unknown or private number? this may be a scam.scammers call you pretending to be your bank to retrieve your credit card code! do not communicate it under any circumstances!,"{'Negative': 0.9084853, 'Neutral': 0.08584452, 'Positive': 0.005670184}"
Paris,"bus fire place | the fire was extinguished by the , there are no injuries recorded.","{'Negative': 0.027431764, 'Neutral': 0.73149383, 'Positive': 0.24107444}"
Paris,"fire of a bus in place with big smoke release. the emergency services intervene, bypass the area.","{'Negative': 0.21010183, 'Neutral': 0.7198272, 'Positive': 0.07007093}"
Paris,"| to start the week in great shape, a good morning workout! good start to the week everyone!","{'Negative': 0.0008420154, 'Neutral': 0.012453524, 'Positive': 0.98670447}"
Paris,"last night in , the of the local bac noticed individuals talking near a vehicle. at their sight, of them boarded and tried to flee.immediate control: kg of cannabis discovered arrests","{'Negative': 0.43029526, 'Neutral': 0.54385024, 'Positive': 0.025854472}"
Paris,"yesterday morning in , a woman managed to escape the blows of her spouse and call the . under the influence of alcohol, he was immediately arrested by the police who arrived on the scene. in case of emergency, contact victims or witnesses:","{'Negative': 0.2815496, 'Neutral': 0.6560419, 'Positive': 0.062408466}"
Paris,"light on from the shadows... yet at the origin of most police interventions!day and night, the women and men of the pfau respond to calls , and .want to know more ? watch one of our immersive videos","{'Negative': 0.031805687, 'Neutral': 0.7246871, 'Positive': 0.24350731}"
Paris,there's the ... and then there's all the others. never share your bank details on the internet.victim of a romance scam? call the toll free info scams file a complaint,"{'Negative': 0.85560036, 'Neutral': 0.13645217, 'Positive': 0.007947465}"
Paris,do you decide to open a window to ventilate your accommodation while you go for a walk this weekend? bad idea! this imprudence makes it easier for burglars!,"{'Negative': 0.6105749, 'Neutral': 0.31883195, 'Positive': 0.07059317}"
Paris,as well as our map [2/2],"{'Negative': 0.06952599, 'Neutral': 0.84706634, 'Positive': 0.08340769}"
Paris,"| this sunday april will take place the paris marathon.traffic restrictions will be in place, see our press release [1/2]","{'Negative': 0.25523004, 'Neutral': 0.71203166, 'Positive': 0.03273823}"
Paris,| the investigators of the dspap (75.92) have once again demonstrated their collective involvement by identifying an individual following a burglary committed in . burglaries solved in the paris area. arrest,"{'Negative': 0.085187405, 'Neutral': 0.81828046, 'Positive': 0.09653214}"
Paris,"| it's very cold in le-de-france: may be present on the roads, especially tonight and tomorrow morning.stay vigilant!","{'Negative': 0.36541903, 'Neutral': 0.54511577, 'Positive': 0.08946515}"
Paris,"| convict escaped from prison and became head of a brigade, vidocq inspired the greatest writers of his time.listen to the st episode on youtube and on all listening platforms","{'Negative': 0.004374782, 'Neutral': 0.22444542, 'Positive': 0.77117974}"
Paris,"last night in , a driver and his passengers were violently attacked by a group of individuals with baseball bats and tear gas. the latter fled by car before being apprehended on the a86 by the of the arrests","{'Negative': 0.86308926, 'Neutral': 0.13097697, 'Positive': 0.005933781}"
Paris,"- tonight and tomorrow morning, a cold wave will cross ile-de-france and snowfall is expected.: take all precautions for your vehicle; : be vigilant tomorrow when leaving your home.","{'Negative': 0.11165978, 'Neutral': 0.7950353, 'Positive': 0.093304954}"
Paris,risk of in le-de-france tonight and tomorrow morning up to cm locally according to . be careful on the road and stay tuned to the evolution of the situation.,"{'Negative': 0.09336411, 'Neutral': 0.8601142, 'Positive': 0.046521682}"
Paris,| here is your favorite picture of the month of march on our instagram account! don't hesitate to subscribe to our account to enjoy new shots,"{'Negative': 0.00080588984, 'Neutral': 0.033954233, 'Positive': 0.9652398}"
Paris,"once again, the of the dspap have achieved great business operation of the brigade des enqutes d'initiative with kg of cannabis seized kg of cannabis seized kg of cannabis discovered arrests","{'Negative': 0.0043395977, 'Neutral': 0.13438211, 'Positive': 0.8612783}"
Paris,"in , starting from a burglary committed at the end of , the investigators of the burglary group of the territorial security of the were able to identify the thieves and, thanks to meticulous work, impute to them other burglaries. arrests made yesterday.","{'Negative': 0.15605547, 'Neutral': 0.764238, 'Positive': 0.07970658}"
Paris,"the exhibition ""la police des meurs paris"" is already a success! you know ? in addition to free or guided tours, the museum offers conferences! to discover the program and register","{'Negative': 0.0009515233, 'Neutral': 0.026424192, 'Positive': 0.97262424}"
Paris,"| discover the digital version of the new issue of , the magazine.entitled police ., this special issue is devoted to the incredible leap forward in technologies of the police headquarters!","{'Negative': 0.0032234564, 'Neutral': 0.1700565, 'Positive': 0.82672}"
Paris,"yesterday in , the from the dspap were requested by a passerby who told them that he had witnessed a watch theft.thanks to the information of the witness, the intercepted the bus in which the perpetrators had boarded: watch found arrests","{'Negative': 0.2639859, 'Neutral': 0.6999114, 'Positive': 0.03610268}"
Paris,"| little useful reminder beware of flyers in mailboxes, stickers on your : do not call the numbers listed. contact your insurer, concierge, trustee before the work and ask for a detailed quote before intervention.","{'Negative': 0.3205024, 'Neutral': 0.6384487, 'Positive': 0.04104895}"
Paris,"an investigation has been opened concerning the police intervention which took place on saturday afternoon in sevran. following the violence and damage committed in seine-saint-denis, arrests were made this weekend and the police arrested people last night.","{'Negative': 0.6516729, 'Neutral': 0.33712628, 'Positive': 0.011200784}"
Paris,"yesterday morning, a woman was hit by her spouse in the streets of . she was transported to the hospital by the violent companion arrested by local police soon after.victims or witnesses:","{'Negative': 0.72428507, 'Neutral': 0.26780653, 'Positive': 0.0079084635}"
Paris,| the pm10 particle pollution episode in le-de-france will end tomorrow. lifting of emergency measures today at :59 p.m.,"{'Negative': 0.10871244, 'Neutral': 0.826925, 'Positive': 0.06436254}"
Paris,"| do you know the cadets of the republic? this device allows young people without a diploma condition to be accompanied to prepare for the peacekeeper competition. registration closes: april ,","{'Negative': 0.09569613, 'Neutral': 0.8339646, 'Positive': 0.07033926}"
Paris,control operation this sunday at place vauban for a wild gathering of old vehicles generating nuisance: verbalizations for crit'air sticker for non-presentation of documents for speed for non-compliant plates,"{'Negative': 0.5998922, 'Neutral': 0.38459623, 'Positive': 0.015511566}"
Paris,"| the episode of particle pollution (pm10) continues in le-de-france.the measures taken, in the first place of which the differentiated traffic as well as the reduction of authorized speeds, therefore remain applicable at least until monday.","{'Negative': 0.08352937, 'Neutral': 0.8382727, 'Positive': 0.07819789}"
Paris,"| many of you still ask us for advice after receiving this type of email. don't answer it, it's a scam!more details in our previous tweet","{'Negative': 0.8290824, 'Neutral': 0.15842201, 'Positive': 0.012495523}"
Paris,". at the same time, other individuals, arrived by car, tried to recover something in this same top box. new arreststhe bag thrown into the water was recovered by the river brigade : it contained kg of cocaine!","{'Negative': 0.30628577, 'Neutral': 0.6211192, 'Positive': 0.07259504}"
Paris,"yesterday afternoon at , a surprising affair that took place in stages:1. during a traffic check, a man on a scooter grabbed a bag stored in his top box and threw it into the canal. immediate arrest by the .","{'Negative': 0.5553801, 'Neutral': 0.41328454, 'Positive': 0.031335358}"
Paris,new immersive video! head to the old quarries of paris (and in particular the catacombs) with and the of the intervention and protection group (gip)!full video on youtube,"{'Negative': 0.00840474, 'Neutral': 0.63093776, 'Positive': 0.36065742}"
Paris,"| the de la sret rgionale des transports have dismantled a ""crack kitchen"" whose ""cook"" usually sold on the auguste baron sector in seizure of crack + arrests (107 people arrested at the start of )","{'Negative': 0.50328827, 'Neutral': 0.4758548, 'Positive': 0.020856885}"
Paris,"pollution (pm10) in idf.implementation of measures from /26 between :30 a.m. and midnight, until the end of the pollution episode: differentiated circulation ( crit'air to allowed to circulate) reduction of authorized speeds information","{'Negative': 0.19332229, 'Neutral': 0.7645922, 'Positive': 0.04208563}"
Paris,throwing projectiles at a presidential candidate during a trip to the porte de la villette sector in this morning. alleged author arrested by the police.,"{'Negative': 0.79115623, 'Neutral': 0.20147854, 'Positive': 0.007365211}"
Paris,"the dspap are tirelessly involved in the fight.review of cases carried out yesterday in , , : arrests seizure of more than kg of cannabis, cocaine, mdma as well as handgun and numerous bladed weapons.","{'Negative': 0.15313601, 'Neutral': 0.76792, 'Positive': 0.07894394}"
Paris,the teenager was found safe and sound last night. thank you for your mobilization and your many shares on social media.,"{'Negative': 0.0027463525, 'Neutral': 0.05588606, 'Positive': 0.9413675}"
Paris,the teenager was found safe and sound last night. thank you for your mobilization and your many shares on social media.,"{'Negative': 0.0027463525, 'Neutral': 0.05588606, 'Positive': 0.9413675}"
Paris,episode of fine particle (pm10) tomorrow in le-de-france. the prefect of police sets up an information and recommendation system: postpone road trips reduce your speed favor carpooling... check out our pr,"{'Negative': 0.11605833, 'Neutral': 0.74895406, 'Positive': 0.13498768}"
Paris,"dismantling in by the dspap called by a person who noticed that the door of a dwelling, supposed to be unoccupied, had been forced. inside a man... with kg of cannabis! immediate questioning","{'Negative': 0.43620402, 'Neutral': 0.541349, 'Positive': 0.022446975}"
Paris,| is a practice of disclosing and communicating a person's personal information to others in order to harm them. these facts are punishable by law!are you a victim of it? report them here,"{'Negative': 0.87462074, 'Neutral': 0.12050176, 'Positive': 0.0048774956}"
Paris,"a nd crew slowed traffic and arrested the driver, for: endangering the lives of others driving without a license refusal to comply hit and run damage to private property driving under the influence of narcotics","{'Negative': 0.83723456, 'Neutral': 0.15486048, 'Positive': 0.007904911}"
Paris,"taking all the risks to escape control is useless and dangerous. , in , a police crew took charge of a vehicle that refused control. in his escape, the man hit at least in circulation.no injuries","{'Negative': 0.80377376, 'Neutral': 0.18166608, 'Positive': 0.01456021}"
Paris,but where can these policemen be?answer friday at p.m. new immersion video with on our youtube channel! subscribe and activate the bell so you don't miss a thing!,"{'Negative': 0.0059269313, 'Neutral': 0.37272292, 'Positive': 0.6213501}"
Paris,"in the event of an attack in the in idf, the of the regional transport security of the carry out the investigations at the end of january, individuals stole with extreme violence the of young girls at epne-mzires station. the investigation led to arrests","{'Negative': 0.58454794, 'Neutral': 0.40259513, 'Positive': 0.012856863}"
Paris,"| thank you for your rts to help investigators find cisse ibrahim, a -year-old autistic boy who ran away from his hotel () on march .if you have information pppj-appelatemoin.gouv.fr","{'Negative': 0.051011905, 'Neutral': 0.5730876, 'Positive': 0.37590057}"
Paris,"| all mobilized against ghb. victims or witnesses, how to react? if a person reports being assaulted: in case of emergency: or","{'Negative': 0.50000703, 'Neutral': 0.4895552, 'Positive': 0.010437819}"
Paris,"yesterday in , a schoolboy was threatened by minors and forced to give them his .thanks to their description: arrests by local and found.when you are a victim there is nothing to be ashamed of. tell those around you in case of emergency:","{'Negative': 0.6830982, 'Neutral': 0.29524115, 'Positive': 0.021660693}"
Paris,"yesterday in and , video surveillance operators quickly transmitted to the of the the description of individuals who stole the personal belongings of metro users: arrests + personal effects found","{'Negative': 0.42956632, 'Neutral': 0.55172193, 'Positive': 0.018711768}"
Paris,"| since paris never sleeps then the either! protect, assist, rescue, secure, investigate, etc. it's day and night and days a week!good week to you all !","{'Negative': 0.003966901, 'Neutral': 0.076966755, 'Positive': 0.91906637}"
Paris,the app is available! chat /7 with a police officer or a gendarme. get advice and practical information. file a pre-complaint online. android: :,"{'Negative': 0.013332676, 'Neutral': 0.4973662, 'Positive': 0.48930117}"
Paris,"in the event of a fall, with certified gloves, hand injuries are reduced or avoided in % of cases for motorcyclists and % of cases for scooter riders. as for the helmet, they are mandatory for you and your passenger","{'Negative': 0.12271464, 'Neutral': 0.5938057, 'Positive': 0.28347975}"
Paris,"| screens can be harmful to your child, especially through video games. as with movies and tv series, they are not suitable for all ages. to guide you there is signage. a game marked is not suitable for a minor!","{'Negative': 0.95258445, 'Neutral': 0.043570735, 'Positive': 0.0038447643}"
Paris,"of the brb | the of arrested criminals engaged in breaking and entering in a sports sign. caught in the act, the individuals were apprehended.review deferral of the arrested damage estimated at around","{'Negative': 0.40597358, 'Neutral': 0.57767606, 'Positive': 0.016350368}"
Paris,"| any reading advice for the weekend?discover the new novel ""the whisper of lost souls"" by georges salinas, former deputy head of the research and intervention brigade.find an overview of the book on our blog","{'Negative': 0.017211515, 'Neutral': 0.7893571, 'Positive': 0.19343139}"
Paris,"| in this new historical podcast, you will discover the evolution of the means of transport of the police in with road anecdotes! from two to four wheels, put on gloves and headphones to patrol alongside the","{'Negative': 0.023179842, 'Neutral': 0.7387412, 'Positive': 0.23807898}"
Paris,"the of the cynophile crew smelled traffic again! operation of the of the dspap in where the search of an apartment leads to the seizure of kg of cannabis individuals, present in the apartment, were arrested","{'Negative': 0.50661904, 'Neutral': 0.46866328, 'Positive': 0.024717605}"
Paris,"innovation at :as part of the national plan for maintaining order, the pp is experimenting with the use of variable message signs during demonstrations in order to inform participants in real time (exit routes, call for dispersal, etc.).","{'Negative': 0.011617681, 'Neutral': 0.77419084, 'Positive': 0.21419151}"
Paris,"| today is the start of the festival!winner last year, henri scala, police commissioner, looks back on the writing work that led him, with his comic ""gost "", to win one of the most prestigious prizes","{'Negative': 0.0022091265, 'Neutral': 0.18501918, 'Positive': 0.81277174}"
Paris,| are you fascinated by criminal stories and do you like discovering extraordinary courses?immerse yourself in podcaststify apple podcasts google podcasts,"{'Negative': 0.008102951, 'Neutral': 0.4546845, 'Positive': 0.5372126}"
Paris,"| in , the territorial bac arrested individuals selling narcotics in a building hall: g cannabis and weed resin in cash","{'Negative': 0.39340073, 'Neutral': 0.5912429, 'Positive': 0.015356334}"
Paris,"action supported by police officers:at , people were arrested as well as a consumer. after a search, the discovered: kg cannabis resin in cash","{'Negative': 0.30243605, 'Neutral': 0.64524394, 'Positive': 0.05231999}"
Paris,"| new exhibition from march to august , at the museum!from the ""ladies"" department to the pimping repression brigade, discover or rediscover the history of the moral police in .","{'Negative': 0.11595279, 'Neutral': 0.7827398, 'Positive': 0.10130734}"
Paris,"answer fight against scams, health, veterinary or security inspections... the missions are numerous for the agents of the departmental directorate for the protection of populations!","{'Negative': 0.090691105, 'Neutral': 0.6955697, 'Positive': 0.21373916}"
Paris,| it's world consumer rights day! do you know this entity - attached to the direction des transports et de la protection du public (dtpp) - which ensures that they are respected? many acronyms below!,"{'Negative': 0.047054276, 'Neutral': 0.6932542, 'Positive': 0.25969157}"
Paris,"rue duquesne | end of the police action, the entrenched individual was arrested.","{'Negative': 0.18336892, 'Neutral': 0.7760897, 'Positive': 0.040541347}"
Paris,intervention of law enforcement in progress avenue duquesne in . avoid the area.,"{'Negative': 0.38089544, 'Neutral': 0.5985286, 'Positive': 0.020575922}"
Paris,calling while driving multiplies the risk of an accident by . there are many solutions to avoid being tempted to answer a call while driving. good road !,"{'Negative': 0.3733046, 'Neutral': 0.45073548, 'Positive': 0.17595986}"
Paris,"| do we start the week with a smile? in early march, the association and the intervention brigade organized a visit to for children fighting cancer. a nice parenthesis for these brave patients!","{'Negative': 0.004541298, 'Neutral': 0.08923929, 'Positive': 0.9062195}"
Paris,"the local police went immediately to the scene but the violent partner had fled. the latter will finally be arrested in the morning at his home. the victim was transported to the hospital. his vital prognosis is, very fortunately, not engaged.","{'Negative': 0.4686017, 'Neutral': 0.46199307, 'Positive': 0.06940528}"
Paris,"| yesterday morning at , a woman managed to take refuge on the roof of her home after being abused and threatened with death by her partner.saving reaction from a neighbor, alerted by the cries of the victim, who called .","{'Negative': 0.36936644, 'Neutral': 0.5850382, 'Positive': 0.04559544}"
Paris,"| the risk of an accident when you call while driving is multiplied by , and by when reading or sending an sms. don't take unnecessary risks for yourself and other road users","{'Negative': 0.7374716, 'Neutral': 0.24457917, 'Positive': 0.017949289}"
Paris,end of the law enforcement mission full of emotions thursday for dopc who helped a woman give birth to a little girl... in her ... in the middle of the square of la concorde before the arrival of the ! parents and welcome baby !,"{'Negative': 0.021274414, 'Neutral': 0.3783111, 'Positive': 0.60041445}"
Paris,"| are you a victim or witness of school bullying? we are here to help you : faced with a harassment situation facing a situation of cyberbullying in case of emergency, dial","{'Negative': 0.2784225, 'Neutral': 0.62638927, 'Positive': 0.09518819}"
Paris,"last night at , individuals knocked a pregnant woman to the ground in order to steal her bag. particularly vigilant about snatching at night, dspap police arrested minors the victim was taken to hospital","{'Negative': 0.64260083, 'Neutral': 0.34628397, 'Positive': 0.011115192}"
Paris,"the main mission of the dspap ? ensure your safety but also that of your property!since last night, they have intervened in burglaries in paris, in the and . individuals arrested for break-ins in homes, shops and even school!","{'Negative': 0.4014511, 'Neutral': 0.53257716, 'Positive': 0.06597174}"
Paris,"on this day of national tribute to the victims of terrorism, the prefect of police decorated several bri operators for acts of courage and dedication.","{'Negative': 0.026012134, 'Neutral': 0.38287836, 'Positive': 0.5911095}"
Paris,"| new video online!between immersive shooting and circuit driving, discover 's day with our police trainers.","{'Negative': 0.020287614, 'Neutral': 0.710339, 'Positive': 0.26937336}"
Paris,"| christophe molmy, current head of the brigade for the protection of minors , returns with a new novel entitled: ""the pit of souls"".find the interview with the author on our blog","{'Negative': 0.03526049, 'Neutral': 0.90354294, 'Positive': 0.06119659}"
Paris,"on this , we pay tribute to the victims of terrorism.let's stay united and united, let's remember and honor their memory. our thoughts are with the families, the injured, and our forces facing this threat. 'snever forget","{'Negative': 0.13581708, 'Neutral': 0.521589, 'Positive': 0.342594}"
Paris,"if you witness a video of ""happy slapping"" on social media don't relay it report its content to the police via the platform.","{'Negative': 0.75426346, 'Neutral': 0.23816577, 'Positive': 0.007570779}"
Paris,"alerted by a video in which a minor suffered violence and humiliation, the police officers of the minors protection brigade and those of coordinated to intervene at the reported address and quickly free the young girl. .5 arrests","{'Negative': 0.64047396, 'Neutral': 0.33878526, 'Positive': 0.020740751}"
Paris,"| tomorrow pm, new youtube video with !shooting stand, driving on circuit, simulator.. to not miss anything, stay tuned","{'Negative': 0.004259331, 'Neutral': 0.52823484, 'Positive': 0.4675058}"
Paris,"| you may pass by it every day, but have you ever paid attention to certain details of the caserne de la cit?more new shots on our instagram account","{'Negative': 0.01433746, 'Neutral': 0.8776789, 'Positive': 0.10798368}"
Paris,"yesterday in , the were monitoring men with suspicious behavior:the st was talking with the driver of a stopped , the nd was on watch and the rd was stealing equipment from the back of the . this theft by trickery will not have fooled the ! arrests","{'Negative': 0.75948286, 'Neutral': 0.22944312, 'Positive': 0.011073962}"
Paris,"the will be present on at , a trade show reserved for emergency and prevention professionals, on the occasion of a round table dedicated to the olympic and paralympic games.want to attend? registrations","{'Negative': 0.018936764, 'Neutral': 0.85032386, 'Positive': 0.13073935}"
Paris,"two ""wanted"" posters, showing a group photo of police officers and accompanied by a threatening sentence, were discovered in .the prefect of police filed a complaint and an investigation was opened to find the perpetrators.","{'Negative': 0.68486565, 'Neutral': 0.30764845, 'Positive': 0.00748585}"
Paris,"""i was dancing, i sat down then, the black hole.""these kinds of testimonials are flooding .the ministry of the interior is mobilizing to fight against attempts at chemical submission to .how to spot them and react?","{'Negative': 0.32924005, 'Neutral': 0.6281884, 'Positive': 0.04257162}"
