user,senti_text_processed,sentimenal_res
Bern,"hmm, i think that's realistic - real looking weapons (gotcha etc.) are banned about the same as the real counterparts.","{'Negative': 0.22054502, 'Neutral': 0.70264584, 'Positive': 0.07680919}"
Bern,"i don't believe you because the police would probably assume so in such a case. became that it s. to e. real pistol - then it would probably not only send the , but came with a special uniform (bulletproof vests etc) &amp; half the city was cordoned off.","{'Negative': 0.44852722, 'Neutral': 0.51455015, 'Positive': 0.036922615}"
Bern,"who ever wanted water pistols to be banned? who was so , huh?-&gt;well, now you have the salad. (apart from that, i think it's a ""story from the "" anyway, right? )","{'Negative': 0.4420534, 'Neutral': 0.500875, 'Positive': 0.05707154}"
Bern,"i also joined a little later, then asked a few viewers what had happened and they told me so. and i heard his friend say: you couldn't take him with you because of a water gun...","{'Negative': 0.41523564, 'Neutral': 0.54845965, 'Positive': 0.036304716}"
Bern,"sorry, i don't believe you now or there is a lot of information missing!","{'Negative': 0.84104127, 'Neutral': 0.15001227, 'Positive': 0.008946351}"
Bern,"just experienced: a foreigner plays with a water gun. someone calls the police because the pistol looks real. the police comes with a detective, finds out that it's a water pistol and takes him away anyway, in handcuffs. wtf ?","{'Negative': 0.6826225, 'Neutral': 0.29596338, 'Positive': 0.021414142}"
Bern,what is the reason why the post office at bern hb is so closed on? m.m. that's a wrong sign in times of rising assaults. desperate people keep getting stranded in front of the intercom system and sometimes wait a very long time.,"{'Negative': 0.95805055, 'Neutral': 0.03947637, 'Positive': 0.0024730866}"
Bern,effort for the police in switzerland since the ukraine war too great.swiss army to protect russian embassythe cantonal police hired a private security service to protect the russian embassy in bern. now even the deployment of the army is being examined.,"{'Negative': 0.23537639, 'Neutral': 0.68227905, 'Positive': 0.082344584}"
Bern,rt : the behavior of the cantonal police in bern on may was at least questionable. we therefore demand answers from the community...the behavior of the cantonal police in bern on may was at least questionable. we are therefore demanding answers from the local council through inquiries in the city council:,"{'Negative': 0.5847864, 'Neutral': 0.39487824, 'Positive': 0.020335333}"
Bern,the behavior of the canton police in bern on may was at least questionable. we therefore demand answers from the municipal council by asking the city council:,"{'Negative': 0.688688, 'Neutral': 0.29971513, 'Positive': 0.011596882}"
Bern,reminds me of something..,"{'Negative': 0.10275269, 'Neutral': 0.8213173, 'Positive': 0.07593006}"
Bern,rt : thanks to for this constant commitment. thanks to for this constant commitment.,"{'Negative': 0.0063977297, 'Neutral': 0.13446562, 'Positive': 0.8591367}"
Bern,thanks to for this constant commitment.,"{'Negative': 0.0052849133, 'Neutral': 0.13331544, 'Positive': 0.86139965}"
Bern,"""on request, the cantonal police in berne said that investigations were being carried out with the owner of the crane regarding criminal acts.""private property / private propertytherefore certainly no legal action.","{'Negative': 0.34631506, 'Neutral': 0.6083426, 'Positive': 0.045342356}"
Bern,bernese canton police call for reinforcement of the army to protect russian diplomatshotspot embassy protection &amp; bund,"{'Negative': 0.11492568, 'Neutral': 0.84917444, 'Positive': 0.03589997}"
Bern,how do the police and prosecutors deal with women who are victims of abuse? the cantonal police in bern do not want to have acted insensitively.,"{'Negative': 0.8664283, 'Neutral': 0.1290828, 'Positive': 0.004488926}"
Bern,"with a hidden camera, a man recorded women in the shower. the cantonal police in bern denies that they acted insensitively in their investigations.","{'Negative': 0.62420535, 'Neutral': 0.35858065, 'Positive': 0.017214024}"
Bern,did the cantonal police in bern expose young women to a humiliating situation during questioning? the cantonal police reject the allegations.,"{'Negative': 0.86032313, 'Neutral': 0.13597792, 'Positive': 0.003698986}"
Bern,canton police bern: the annual report of the guard of honor of the canton bern took place in the bern town hall on friday. afterwards the th anniversary of the formation of honor was celebrated on the occasion of a jubilee ceremony,"{'Negative': 0.0039091436, 'Neutral': 0.63474, 'Positive': 0.3613508}"
Bern,"racist police controls are a reality for many residents of the city of bern. nevertheless, neither the cantonal police nor the cantonal politicians want to recognize this as an institutional problem. for this reason it needs an independent evaluation.","{'Negative': 0.76259434, 'Neutral': 0.22462437, 'Positive': 0.012781237}"
Bern,canton police bern: on monday evening a woman fell over a rock ledge in bonigen while hiking. she could only be recovered dead. the course of the accident is being investigated.,"{'Negative': 0.75719094, 'Neutral': 0.23218356, 'Positive': 0.010625513}"
Bern,"are also increasing in the canton of . however, the police sees itself armed for the fight against internet criminals.","{'Negative': 0.07889572, 'Neutral': 0.8030588, 'Positive': 0.11804553}"
Bern,"canton police bern: in the canton of bern, there have been repeated cyber attacks on companies and communities in recent times. well-trained specialists are important for the investigations -","{'Negative': 0.6176872, 'Neutral': 0.3558931, 'Positive': 0.026419604}"
Bern,"the man apparently suffered broken bones in his face and a serious eye injury.as the cantonal police in bern informed me in march, the public prosecutor's office has opened proceedings. the investigation is being conducted - you guessed it - by the cantonal police in bern themselves.","{'Negative': 0.6509031, 'Neutral': 0.33144116, 'Positive': 0.017655749}"
Bern,"although the police emphasize that you can aim very precisely with the sir, the bern canton police most likely shot an ice hockey fan in biel in the face with a sir last february.","{'Negative': 0.6975533, 'Neutral': 0.2910329, 'Positive': 0.011413843}"
Bern,"the sir has so much energy that it can break bones and seriously injure internal organs. in , the cantonal police of bern shot a young man in the genital area with such a projectile. one of his testicles burst, part of the affected tissue died","{'Negative': 0.9337327, 'Neutral': 0.06153457, 'Positive': 0.00473271}"
Bern,an tried to a man's bag on the train between and on sunday. the police in bern are now looking for the who were on the train at the time of the events and who helped the man.,"{'Negative': 0.3262473, 'Neutral': 0.64347416, 'Positive': 0.030278537}"
Bern,"cantonal police bern: during a major exercise in the night from wednesday to thursday in and around the allmend tunnel in thun, the blue light and partner organizations witnessed a realistically portrayed major event","{'Negative': 0.025482344, 'Neutral': 0.843135, 'Positive': 0.13138266}"
Bern,"the basel government councilor stephanie eymann. there was no damage to property in bern. the cantonal police has not even published a media release.it seems to me that it's more about a feeling of ""evil"" demos than about actual events.","{'Negative': 0.5583556, 'Neutral': 0.39663815, 'Positive': 0.04500621}"
Bern,the basel police need new management and further training for the cantonal police in bern.,"{'Negative': 0.1357073, 'Neutral': 0.8103273, 'Positive': 0.053965356}"
Bern,"the city of nidau, together with the cantonal police in bern, is making road users aware of the rules of conduct in the meeting zone at the aalmatten kindergarten. zone","{'Negative': 0.041332975, 'Neutral': 0.8798826, 'Positive': 0.078784354}"
Bern,"cantonal police bern: on saturday afternoon a car left the road in ins, slid over a slope and overturned onto the railway tracks. the driver was able to free himself from the car before it was hit by a na","{'Negative': 0.38619274, 'Neutral': 0.5705347, 'Positive': 0.0432726}"
Bern,the police of bern checked people on tuesday evening in bern- as part of an action to illegal . one person was arrested and several thousand francs in cash were seized.,"{'Negative': 0.5103775, 'Neutral': 0.47313794, 'Positive': 0.01648452}"
Bern,"the canton police caught two suspected fraudsters. a -year-old and a -year-old man, posing as bank employees, tried to convince an elderly woman that she had been the victim of fraud.","{'Negative': 0.75882065, 'Neutral': 0.23146798, 'Positive': 0.00971137}"
Bern,"on wednesday, an -bike handlebar fell near in . he was badly injured. according to the police , the report was received around p.m.","{'Negative': 0.59240824, 'Neutral': 0.39008003, 'Positive': 0.017511679}"
Bern,"bern canton police: after three climbers could not be reached since friday, a comprehensive search operation was initiated on saturday. on sunday morning the three missing persons were found below the jegigl","{'Negative': 0.44078353, 'Neutral': 0.5367352, 'Positive': 0.022481384}"
Bern,"on saturday, the cantonal police in bern started a search for three climbers from the netherlands. they were found dead on sunday.","{'Negative': 0.6079119, 'Neutral': 0.37695083, 'Positive': 0.01513724}"
Bern,"canton police bern: on wednesday morning in bern on the a1 west autobahn in the direction of lausanne, a traffic accident involving three vehicles occurred. two drivers were injured. they were thrown into the spit","{'Negative': 0.77199966, 'Neutral': 0.21670705, 'Positive': 0.011293205}"
Bern,"a police officer hit a man in the head in bern. the procedure was legitimate, the canton police now find.","{'Negative': 0.46160743, 'Neutral': 0.50839585, 'Positive': 0.029996756}"
Bern,"a police officer hit a man in the head in bern. the procedure was legitimate, the canton police now find.","{'Negative': 0.46160743, 'Neutral': 0.50839585, 'Positive': 0.029996756}"
Bern,the cantonal police in bern also relies on electromobility for emergency vehicles - even if we don't currently have any teslas in our fleet,"{'Negative': 0.08425481, 'Neutral': 0.789259, 'Positive': 0.12648614}"
Bern,"canton police bern: on easter monday, the football match between bsc young boys and grasshopper club zurich will take place in bern. the bern cantonal police advise match visitors early on with an o","{'Negative': 0.024935916, 'Neutral': 0.9315035, 'Positive': 0.043560665}"
Bern,the in uettligen on march th could be traced back to human fault. this was announced by the cantonal police in . she is looking for .,"{'Negative': 0.3547418, 'Neutral': 0.62397546, 'Positive': 0.021282714}"
Bern,bern canton police: two cars collided in bargen on tuesday afternoon. a car caught fire. two people had to be taken to the hospital with minor injuries. investigations to clarify the course of the accident wu,"{'Negative': 0.65210485, 'Neutral': 0.32993478, 'Positive': 0.0179604}"
Bern,"a was hit by a in on tuesday morning. she succumbed to her severe injuries on the spot, according to the cantonal police in bern. the is clarified.","{'Negative': 0.51915044, 'Neutral': 0.45847368, 'Positive': 0.022375867}"
