user,senti_text_processed,sentimenal_res
Riga,we need bigger brains not winters!,"{'Negative': 0.43227538, 'Neutral': 0.42194316, 'Positive': 0.14578143}"
Riga,", you have to stop and turn around dishonest drivers, not indifferent ordinary people","{'Negative': 0.7591014, 'Neutral': 0.22516863, 'Positive': 0.0157299}"
Riga,"sober, the principle works, if one can do it, then i can too.","{'Negative': 0.006696049, 'Neutral': 0.20143841, 'Positive': 0.79186547}"
Riga,"if a pole can drive, why can't i drive a car?!","{'Negative': 0.5244428, 'Neutral': 0.43904254, 'Positive': 0.036514632}"
Riga,"until the nearest intersection, well, don't cross the intersection or driveway on the bus lane.","{'Negative': 0.31698084, 'Neutral': 0.6507403, 'Positive': 0.03227884}"
Riga,"well, i would say that this is against the constitution and human rights. what's the deal with a drone that flies and records parking lots?if the video material doesn't count as an experience without other experiences - go to dirst! completely free lane and you write to smart people with punishments....","{'Negative': 0.7791743, 'Neutral': 0.20292193, 'Positive': 0.017903728}"
Riga,"""kiegela"" warnings are made up a lot. when i went there, after putting it on, i didn't fly, because i understood that it wouldn't be good. so are the drivers - if the public transport is driving, then i can too, i don't bother anyone at all.","{'Negative': 0.78193706, 'Neutral': 0.19490325, 'Positive': 0.023159731}"
Riga,maybe they are driving to the house because they are allowed to drive under this brick.,"{'Negative': 0.32691136, 'Neutral': 0.64376587, 'Positive': 0.02932275}"
Riga,"for example, on the deglava bridge, when driving in the direction of the center, the lanes break apart, which you cannot see if there are traffic jams, which is practically always the case on that bridge. of course, no one knew how to put at least one zim before that for the fact that the lanes come together alone, because ""you can see it""","{'Negative': 0.44799447, 'Neutral': 0.47020206, 'Positive': 0.08180342}"
Riga,can you see the picture?,"{'Negative': 0.11226732, 'Neutral': 0.8151884, 'Positive': 0.07254426}"
Riga,"is that brick also before the intersection, not just the last bridge? if not, then i don't see a problem. the maintenance workers of riga's roads never think to put the signs together normally, they never think for even minutes that this sign actually means something","{'Negative': 0.7107705, 'Neutral': 0.26048443, 'Positive': 0.028745068}"
Riga,it seems to me that someone has finally messed up the traffic in riga.,"{'Negative': 0.8796562, 'Neutral': 0.11423759, 'Positive': 0.0061062365}"
Riga,% left correctly front cross.,"{'Negative': 0.045820504, 'Neutral': 0.7899582, 'Positive': 0.16422132}"
Riga,"if +% of people don't follow some rule, then the problem is with the rule, not the people. i will definitely go that route.","{'Negative': 0.5319484, 'Neutral': 0.41073242, 'Positive': 0.057319205}"
Riga,"if it's night time there, -30 minutes didn't hurt anyone. completely minor parking lot. you are a servant of the letter.","{'Negative': 0.23245724, 'Neutral': 0.51848364, 'Positive': 0.24905914}"
Riga,"reduce the limits of your caution and with a sense of normality when speeding to - you can't notice that 's nihuja, you need green vests that remind you","{'Negative': 0.31848907, 'Neutral': 0.6118022, 'Positive': 0.069708675}"
Riga,"only a person who doesn't have a passport and a car and a license can write this, because what happens on our street with cobblestones and repair work and traffic orientation has nothing to do with those who ""buy"" the license!","{'Negative': 0.6988153, 'Neutral': 0.27752447, 'Positive': 0.023660168}"
Riga,"well yes, you can also drive in the public transport lane, make a left turn in an unauthorized place, slightly exceed the speed limit, then steal a little, beat someone, what else will we justify?","{'Negative': 0.62703645, 'Neutral': 0.33827135, 'Positive': 0.03469212}"
Riga,"cameras/radars or poles needed to be put together, you don't know why there is a traffic jam, because people have nowhere to go, everyone is on the road to stop and burn fuel and time.","{'Negative': 0.7891418, 'Neutral': 0.19401938, 'Positive': 0.016838828}"
Riga,'s priority is to punish or organize traffic? you sound like a pajoli cantor!,"{'Negative': 0.7618974, 'Neutral': 0.22159255, 'Positive': 0.016510127}"
Riga,"if there is parking, you can definitely look around","{'Negative': 0.007857685, 'Neutral': 0.3839286, 'Positive': 0.6082137}"
Riga,"traffic should be organized, not just imposed!","{'Negative': 0.30157763, 'Neutral': 0.58976364, 'Positive': 0.10865877}"
Riga,"don't cry susurin,","{'Negative': 0.15634757, 'Neutral': 0.6993347, 'Positive': 0.14431779}"
Riga,"please, put together a video from sad raids or info about the number of cases when ""smart people"" get +6 points and go to","{'Negative': 0.2521967, 'Neutral': 0.675968, 'Positive': 0.07183533}"
Riga,"seit everyone looks ""good"". well, but the traffic department of the riga city council is clearly demonstrating its (to put it very mildly) incompetence. right and ?","{'Negative': 0.7995245, 'Neutral': 0.17115697, 'Positive': 0.029318506}"
Riga,"then hats off to the guy! it's just that sometimes the court requires more information, sometimes it seems that it happens episodically.","{'Negative': 0.053138185, 'Neutral': 0.5064696, 'Positive': 0.4403922}"
Riga,"if the memory doesn't disappoint, then hang the transport plane with a camera and film /7 when it goes.","{'Negative': 0.1683056, 'Neutral': 0.7288182, 'Positive': 0.102876276}"
Riga,"you can agree about the examples, but the rules are exactly as written. nothing wrong. so simple.","{'Negative': 0.079473905, 'Neutral': 0.5562028, 'Positive': 0.3643233}"
Riga,"closer to the traffic regulation of the intersection/s, or to be more precise, their absence. i didn't discuss the desire of individual individuals to go around, max one line is rough.","{'Negative': 0.2531926, 'Neutral': 0.6885045, 'Positive': 0.05830286}"
Riga,"drives those drones, that ukraine -pif-paf!","{'Negative': 0.37941298, 'Neutral': 0.5625902, 'Positive': 0.057996802}"
Riga,i have no doubts about the specific situation.,"{'Negative': 0.049103934, 'Neutral': 0.73561203, 'Positive': 0.2152841}"
Riga,wouldn't it be easy not to break the roads until they are no longer passable...and then just punish...,"{'Negative': 0.5697196, 'Neutral': 0.3964253, 'Positive': 0.033855025}"
Riga,"i also only recently - years - with the law, but on the road there are not always only examples of school grammar","{'Negative': 0.17373222, 'Neutral': 0.7632007, 'Positive': 0.06306709}"
Riga,it just sucks for you....even those who have received a fresh diploma think that the whole world is with them!,"{'Negative': 0.8967062, 'Neutral': 0.09414731, 'Positive': 0.00914638}"
Riga,"if there is, then the soferisi know that ""nothing will happen"" to them.","{'Negative': 0.33502024, 'Neutral': 0.6199248, 'Positive': 0.045055002}"
Riga,don't worry about me. i recently got my driver's license and i know the rules perfectly.,"{'Negative': 0.032201663, 'Neutral': 0.36808985, 'Positive': 0.59970844}"
Riga,"and definitely jainformet digs up about it, with a pile of poles and bricks in front of the intersection. when you are already at the tunnel, the back is a car and the other side is also someone driving, turning around is very problematic and bothers everyone.","{'Negative': 0.9083068, 'Neutral': 0.08554321, 'Positive': 0.006150035}"
Riga,hey... is everything okay with you?,"{'Negative': 0.014190981, 'Neutral': 0.6141628, 'Positive': 0.3716462}"
Riga,"rd's incompetence is simply amazing. at times when the deglava bridge is undergoing repairs and projects, it is a bottleneck for the main street, and vietalva street is also closed to traffic, with a bicycle lane and sab. tr. a traffic jam is being created for the lane, vaidavas iela.are you normal there?","{'Negative': 0.82891655, 'Neutral': 0.1523107, 'Positive': 0.018772796}"
Riga,"read it yourself, not everything is clear to you. there are enough opportunities to interpret them in separate places (points) that whoever likes it...","{'Negative': 0.039162353, 'Neutral': 0.59703314, 'Positive': 0.3638045}"
Riga,"h time - that's one parking lot minutes. it seems that only long-term drivers were affected, who could not excuse the need to turn around.","{'Negative': 0.59826624, 'Neutral': 0.3456256, 'Positive': 0.056108177}"
Riga,i believe that all those penalized tried to park behind the left lane instead of trying to turn to the right. it would hardly be controversial then. there are a lot of parks.,"{'Negative': 0.12230073, 'Neutral': 0.6356518, 'Positive': 0.24204743}"
Riga,city?,"{'Negative': 0.1775972, 'Neutral': 0.7113604, 'Positive': 0.11104241}"
Riga,"yes, drought. the car was parked for minutes longer than specified.","{'Negative': 0.29170528, 'Neutral': 0.6126733, 'Positive': 0.09562145}"
Riga,"if there is an intersection on the road or an entrance to the neighboring territory, then it is pretty much guaranteed - you have been driving in a public transport lane for too long.the specific place - entrances + traffic light, the visibility of the court is m.","{'Negative': 0.22783542, 'Neutral': 0.5850677, 'Positive': 0.18709691}"
Riga,isn't there a camera already?,"{'Negative': 0.16474025, 'Neutral': 0.7896488, 'Positive': 0.045610983}"
Riga,also drove a long driveway to the adjacent territory,"{'Negative': 0.07295963, 'Neutral': 0.87096566, 'Positive': 0.056074835}"
Riga,"as i already mentioned - the white line has not been interrupted, which indicates that there are no entrances to the neighboring territories of the specific section. we can see that passport on the map and in life. and of course also the fact that the a band is used.","{'Negative': 0.084838405, 'Neutral': 0.8077874, 'Positive': 0.107374206}"
Riga,of course! why not!? have you never stood at an empty intersection at a red light at night? there are countries where it is allowed to do so. seriously. what did kiegelis do to you? not always an accident situation occurs when driving under it. what is not clear?,"{'Negative': 0.4972854, 'Neutral': 0.4407174, 'Positive': 0.0619972}"
Riga,how long is it illegal to drive in a public transport lane to be considered to have turned from the right lane and not crossed it (or turned from the wrong lane)?,"{'Negative': 0.39738166, 'Neutral': 0.57634795, 'Positive': 0.02627041}"
Riga,"well, you have to renew your knowledge of the driving school, because entering the neighboring territory, which you kindly pointed out, is not an intersection or understanding.","{'Negative': 0.37913182, 'Neutral': 0.58125013, 'Positive': 0.039618094}"
Riga,better read csn.,"{'Negative': 0.2173163, 'Neutral': 0.6269265, 'Positive': 0.15575725}"
Riga,are csn who are jaivero. what is not clear? p.s. what will you offer? drive at a red light if the street is empty? to drive under a kiegel if no one is driving in the opposite direction?,"{'Negative': 0.3595325, 'Neutral': 0.6066785, 'Positive': 0.033789072}"
Riga,tika nedirs!!!,"{'Negative': 0.059172817, 'Neutral': 0.58209044, 'Positive': 0.35873672}"
Riga,why are you worried about this? you probably often drive in the public lane.,"{'Negative': 0.5132383, 'Neutral': 0.46149495, 'Positive': 0.025266709}"
Riga,"well, punish those who interfere with the trolleybus! not those who use free sab.trans. lane!","{'Negative': 0.73015696, 'Neutral': 0.24776545, 'Positive': 0.022077598}"
Riga,csn everything is explained...,"{'Negative': 0.0354697, 'Neutral': 0.63753706, 'Positive': 0.32699332}"
Riga,i have regularly noticed that the trolleybus cannot leave the stop because the public transport lane is for cars. stupid people are those who don't know sn and don't understand that a public transport lane ends behind the respective road. not to mention the non-stop driving.,"{'Negative': 0.91300833, 'Neutral': 0.07676876, 'Positive': 0.010222959}"
Riga,"if you need a camera and a button for sabtrans, which fixes the times when the sabtrans runs a red light!","{'Negative': 0.064070925, 'Neutral': 0.592851, 'Positive': 0.34307814}"
Riga,"similar situation on brieza street, when driving towards the center to turn to the waterfront, according to the rules you have to drive from the left lane to the right,,","{'Negative': 0.1872349, 'Neutral': 0.7785288, 'Positive': 0.03423639}"
Riga,"well, you don't park there with a drone and crew every day. what does this one-time fairy tale/pakazuha give? do you think those leaders will end up in school? don't you think it's funny that there is only one lane leading from riga to the center of a more populated area, where there used to be ?","{'Negative': 0.33958265, 'Neutral': 0.56389135, 'Positive': 0.09652599}"
Riga,and what is the problem with the situation?,"{'Negative': 0.52008796, 'Neutral': 0.46520877, 'Positive': 0.014703257}"
Riga,", take a few hours to the island bridge, where the exit is towards the center of the embankment. cure paralysis, there is anarchy","{'Negative': 0.3752557, 'Neutral': 0.55125743, 'Positive': 0.07348685}"
Riga,if you don't know how to drive and don't understand csn - jamaca driving school and you have to park the exam.,"{'Negative': 0.83005095, 'Neutral': 0.16249025, 'Positive': 0.0074588154}"
Riga,it's enough for the police to fix a long one intersection to believe that the lane was not used to turn. the image shows that there are no courtyards (and therefore also a bold continuous line). red is not a cut-off maneuver.,"{'Negative': 0.36985973, 'Neutral': 0.5383811, 'Positive': 0.09175917}"
Riga,"that place to solve problems during the trip, money is collected for the bonus and poles.","{'Negative': 0.022418689, 'Neutral': 0.6317058, 'Positive': 0.3458755}"
Riga,"parking right for the transport of the ministry of the interior is on the side of the station, the story is on the opposite side.","{'Negative': 0.27807808, 'Neutral': 0.6716531, 'Positive': 0.050268784}"
Riga,"if the turn signal is on and the first lane turns right, then i can't imagine that you could be fined. the driver himself decides when to take the appropriate lane in time and safely.","{'Negative': 0.29463646, 'Neutral': 0.6180313, 'Positive': 0.087332256}"
Riga,there is a parking space on the sidewalk. .celazime does not apply to parking spaces.,"{'Negative': 0.33330402, 'Neutral': 0.6077441, 'Positive': 0.05895181}"
Riga,"it is forbidden to stop and stand in that quarter from to , if i leave the house a little late, then i see that a few minutes after eight she is washing herself from the police station in her private diapers. rpp simply said that they police vehicles and without punishing.","{'Negative': 0.47416195, 'Neutral': 0.49983197, 'Positive': 0.026006065}"
Riga,what's illegal about that parking space? not coordinated with the traffic department?,"{'Negative': 0.77363944, 'Neutral': 0.21932474, 'Positive': 0.007035822}"
Riga,"hey, , you have a month of work in riga traffic in cooperation with . what should be said about the illegal parking space of your employees opposite the matisa street station? one law, one justice.","{'Negative': 0.40385196, 'Neutral': 0.5645741, 'Positive': 0.03157396}"
Riga,"the british do that - a camera is put up and the punishment comes. if you want to drive, it will cost you ps80","{'Negative': 0.6215949, 'Neutral': 0.36178, 'Positive': 0.016625147}"
Riga,"navesspodu for those who ""connected the bricks"" to disturb people--i increase the punishment every time i have to liberate them for ""connecting"" something [ an ice pick for trotskyite sugar ] and cut the lie to the questioner about ""why do you drive under the brick wall?"" ---","{'Negative': 0.7283389, 'Neutral': 0.2593783, 'Positive': 0.012282879}"
Riga,"haha, i told you it would be.","{'Negative': 0.122480705, 'Neutral': 0.628991, 'Positive': 0.24852833}"
Riga,"that's why you also need a drone - so that the smart ones don't think you're just trying to turn right, and you could get used to driving on the public lane for several intersections. kalpak boulevard is marked with a continuous line, which indicates that the public lane does not","{'Negative': 0.26529405, 'Neutral': 0.60308844, 'Positive': 0.13161755}"
Riga,oh poor public transport.... a whole move in that lane..! when did you bother? a bunch of idiots,"{'Negative': 0.9703311, 'Neutral': 0.02594174, 'Positive': 0.0037272454}"
Riga,that riga has been turned into a muhasransk... sadza with one street... and stupid cashiers around the corners.,"{'Negative': 0.8970946, 'Neutral': 0.09453982, 'Positive': 0.008365518}"
Riga,the cretinism of the police following traffic planotaju and talak is all crass.,"{'Negative': 0.8960578, 'Neutral': 0.09849445, 'Positive': 0.0054477314}"
Riga,it's riga's problem. don't you want to take any big steps to improve the public transport network. what to do?,"{'Negative': 0.74481726, 'Neutral': 0.2349963, 'Positive': 0.020186475}"
Riga,"go, not just m from the zebra and wait for someone to think that you want to cross the intersection. then started the st machine, not the th.","{'Negative': 0.36083698, 'Neutral': 0.60225576, 'Positive': 0.03690725}"
Riga,"there is the central market, the ministry of traffic and the other side of the administration until the intersection.","{'Negative': 0.086870216, 'Neutral': 0.8661167, 'Positive': 0.047013037}"
Riga,rent buildings for transport and access to property,"{'Negative': 0.119257905, 'Neutral': 0.83498096, 'Positive': 0.0457612}"
Riga,saja gadijuma is a critical situation. only one band is visible in the image. no dividing dashed or solid lines (excluding velo),"{'Negative': 0.27183065, 'Neutral': 0.6703532, 'Positive': 0.05781617}"
Riga,"says that you are turning right at the pass intersection, right lane.a lane ends in makenit talak after the intersection","{'Negative': 0.06581875, 'Neutral': 0.8908408, 'Positive': 0.043340355}"
Riga,"they put the ""kiegeli"" only before the tunnel, there is no other warning sign. i was driving in the evening when the bus driver directed me to that place. before that there are no warnings anywhere. the fact that there is no drizak can be blamed on the employees, not the drivers","{'Negative': 0.7310052, 'Neutral': 0.24620749, 'Positive': 0.022787271}"
Riga,and that organizing traffic in such a way as to create congestion and increase emissions is in line with climate goals?,"{'Negative': 0.45561516, 'Neutral': 0.4968867, 'Positive': 0.047498137}"
Riga,ideal place to set up video cameras and fix the sos-1x payment penalty and maybe they will say see the road signs! but this is no penalty,"{'Negative': 0.18087955, 'Neutral': 0.66237843, 'Positive': 0.15674205}"
Riga,none,"{'Negative': 0.23360549, 'Neutral': 0.5595244, 'Positive': 0.20687014}"
Riga,"can't understand ""nihuja"" there. i have driven the inertial guide itself at least x. okay, if there are cones, but those cones are very small. plus the public transport movement creates a feeling of ""normality"". i need bigger winters and i recommend green vests that remind me","{'Negative': 0.43153465, 'Neutral': 0.48037994, 'Positive': 0.08808536}"
Riga,there is only one car on the two-lane street... stupid!,"{'Negative': 0.76789534, 'Neutral': 0.18616585, 'Positive': 0.045938715}"
Riga,"i haven't been there since the beginning of the repair, so it's hard to judge how easy it is to understand that there will be bricks. in this situation, it remains either to throw around and delay the traffic, or to drive because they are doing it.but i agree that you can understand that it will be hard there for some time.","{'Negative': 0.50391454, 'Neutral': 0.42041048, 'Positive': 0.07567499}"
Riga,"not enough. this classic situation is called ""do what you want, piss off sa or ta"". eur and penalty points for aggressive driving.","{'Negative': 0.7215184, 'Neutral': 0.25733224, 'Positive': 0.02114943}"
Riga,there is total anarchy on that street every time. it would be enough for two cp crews every rite to supplement the vasta's budget on the fly,"{'Negative': 0.54003644, 'Neutral': 0.40152967, 'Positive': 0.058433834}"
Riga,"everyone doesn't care, are you worried about winter? wait there for a long time, maybe cars have started. god bless you when you do it","{'Negative': 0.11882931, 'Neutral': 0.40197918, 'Positive': 0.4791915}"
Riga,couldn't have put that brick at all. cp policemen are not enough to control..,"{'Negative': 0.78969455, 'Neutral': 0.19650705, 'Positive': 0.013798417}"
Riga,lv it is still more important to cross and punish than to solve so that your corks are as small as possible.,"{'Negative': 0.41406772, 'Neutral': 0.54718286, 'Positive': 0.038749363}"
Riga,"you got it right, you have the courage to go with kayam.","{'Negative': 0.005918294, 'Neutral': 0.1925694, 'Positive': 0.80151224}"
Riga,"idiots are those who say, without an alternative, regulate the traffic!","{'Negative': 0.9122577, 'Neutral': 0.08051573, 'Positive': 0.0072266343}"
Riga,"drive in the a lane, you can show the policeman the climate control, which means that you don't have to create a traffic jam if you want to go ""to the right""","{'Negative': 0.12782596, 'Neutral': 0.6690043, 'Positive': 0.20316967}"
Riga,japasuta from abroad some drone destroyer.the right signals and those drones of yours fall to the ground,"{'Negative': 0.46311238, 'Neutral': 0.510463, 'Positive': 0.026424628}"
Riga,"i'm interested in a question for residents - is the other side of the tunnel a residential sector or something similar? p.s. it is in context with zime, written under the kiegel (""remove the trap for possession"")","{'Negative': 0.037950214, 'Neutral': 0.8264308, 'Positive': 0.13561903}"
Riga,what is written on the page?,"{'Negative': 0.17993909, 'Neutral': 0.7818867, 'Positive': 0.038174257}"
Riga,"not so much. drive up and turn degrees to the right, past the public road and past the bike lane. it's supposed to be ""drosi""!","{'Negative': 0.30398616, 'Neutral': 0.60042286, 'Positive': 0.09559096}"
Riga,"i have a question for the ""experts"". a m wide sidewalk can be seen in the photo. when the hell did you have to jump on the road after the bike lane? that you ""improve"" the speed when performing a turning maneuver to the right, over the nd lane (!),?","{'Negative': 0.5224198, 'Neutral': 0.43721062, 'Positive': 0.040369533}"
Riga,"this place is really critical.is there a sign on raina boulevard, that there are traffic changes, that the joy is ""squatting""?","{'Negative': 0.20520356, 'Neutral': 0.67035925, 'Positive': 0.12443716}"
Riga,"""lai lohi stav"" put on a sausage again! good job","{'Negative': 0.07262002, 'Neutral': 0.2899571, 'Positive': 0.6374228}"
Riga,i really hope that the author has submitted the video to the police to punish all parkapes!,"{'Negative': 0.55306655, 'Neutral': 0.38590908, 'Positive': 0.061024316}"
Riga,"will leave. it is understandable, in the end kiegelis is kiegeis, is jaivero. sometimes it also happens that the section of the road in the summer is full of changes in both lanes and lanes, and ultimately the chance for the driver to make a mistake or not notice one or another instruction increases.","{'Negative': 0.30714038, 'Neutral': 0.59978306, 'Positive': 0.09307656}"
Riga,"well, but you were taught to get a driver's license, according to csn.","{'Negative': 0.21869697, 'Neutral': 0.7502078, 'Positive': 0.031095216}"
Riga,"has already posted signs with the traffic organization change, but no one is looking at it.","{'Negative': 0.423571, 'Neutral': 0.54482573, 'Positive': 0.031603254}"
Riga,"there is both a brick and a different configuration for the intersection and the dividing lanes are changing.people also ignore stones in the opposite direction, where you can't miss it.","{'Negative': 0.27278665, 'Neutral': 0.6264831, 'Positive': 0.10073023}"
Riga,"or kiegeis only meters before the tunnel? if so, wouldn't it be more practical to install it (also) before turning onto that street, so that the oats don't drive there at all..?","{'Negative': 0.13613163, 'Neutral': 0.7761949, 'Positive': 0.08767349}"
Riga,"you know what looks funny? when, after a call, cars are parked on the tracks on mier street, in the opposite direction, in the green zone, first the traffic police pass calmly, then the local police. when do you respect the police?","{'Negative': 0.5492053, 'Neutral': 0.37199864, 'Positive': 0.07879612}"
Riga,why does rpp so often take on the role of parkapei's advocates?,"{'Negative': 0.4358391, 'Neutral': 0.5327039, 'Positive': 0.031457078}"
Riga,"it's amazing how many drivers drive under the kiegel. and please don't stop the drivers for the fourth time and say that they ""can't see the world"" ! if you already saw that the usual tunnel is closed, then you also see that the cone of joy!","{'Negative': 0.13169006, 'Neutral': 0.3674419, 'Positive': 0.5008681}"
Riga,"please tell me what's up with csn point ?can you explain that it is meant to go straight, is it meant to turn left at intersections or any place where it is possible, does it also include neighboring areas?and how many valleys is the exit to the right to sadu road?","{'Negative': 0.12340907, 'Neutral': 0.846024, 'Positive': 0.030566914}"
Riga,don't you want to stay on the earth bridge with a drone? and then additionally on baron x pernava? there you can gather enough time for the renovation of all the streets of riga for a couple of weeks.,"{'Negative': 0.059566345, 'Neutral': 0.85791063, 'Positive': 0.08252301}"
Riga,where sat ends. transport lane. if the lane ends right at the intersection - then where it is separated by a broken line.,"{'Negative': 0.26746812, 'Neutral': 0.70081466, 'Positive': 0.0317172}"
