user,senti_text_processed,sentimenal_res
Riga,and when do those scumbags who do this have problems? too much free time and money.,"{'Negative': 0.9521925, 'Neutral': 0.04412882, 'Positive': 0.0036787775}"
Riga,"riga has become a baking mecca in the last -3 years. if warsaw was a big problem before, now it is already a long time ago. especially bras, the neighborhood of springs","{'Negative': 0.37412032, 'Neutral': 0.49496645, 'Positive': 0.1309133}"
Riga,i like for example italy everything is black and looks dope,"{'Negative': 0.008291937, 'Neutral': 0.09843355, 'Positive': 0.89327455}"
Riga,"thank you. i hope, however, that the abnormal will be caught.","{'Negative': 0.042013302, 'Neutral': 0.37187624, 'Positive': 0.5861104}"
Riga,"thanks for the reply, but what does the recall mean? is that what?","{'Negative': 0.020445973, 'Neutral': 0.7680534, 'Positive': 0.21150061}"
Riga,"in all cases when i had to meet rpp employees, i was pleasantly surprised by their professionalism and positive attitude. thank you!","{'Negative': 0.0017086728, 'Neutral': 0.014183963, 'Positive': 0.9841074}"
Riga,"maybe don't do anything so that the new generation with their protest will live in the old and neglected city. after a couple of lost generations, maybe people will say to underestimate the unfamiliar environment?","{'Negative': 0.6852058, 'Neutral': 0.2922051, 'Positive': 0.022589043}"
Riga,the riga city council is not capable of imposing fines on a car that has been parked incorrectly all day and here they can get a -minute penalty? smile at someone else.,"{'Negative': 0.9419953, 'Neutral': 0.054521978, 'Positive': 0.0034827413}"
Riga,"make riga street culture friendly. would attract a greater number of young people to the city (from abroad), would create rich social soil in riga! etc.","{'Negative': 0.0021694957, 'Neutral': 0.11505476, 'Positive': 0.8827757}"
Riga,"otradi, that clown from cesim, who is the vest","{'Negative': 0.5816536, 'Neutral': 0.39683104, 'Positive': 0.021515371}"
Riga,said a peasant about a state police officer?,"{'Negative': 0.48688608, 'Neutral': 0.49872398, 'Positive': 0.014389985}"
Riga,there are still some who have side effects with the kit...,"{'Negative': 0.5294907, 'Neutral': 0.44948184, 'Positive': 0.0210275}"
Riga,"izradas is also full of militiamengathered the peasants, and explained that there is no village here","{'Negative': 0.429191, 'Neutral': 0.53705835, 'Positive': 0.033750646}"
Riga,"my mistake, i had imagined something, doesn't allow such discussions, both institutions are full of serifs. but thanks for pointing out the visual difference as well.","{'Negative': 0.5067709, 'Neutral': 0.4225455, 'Positive': 0.070683606}"
Riga,where is it?,"{'Negative': 0.16861078, 'Neutral': 0.69288224, 'Positive': 0.13850701}"
Riga,and who doesn't distinguish between rpp and vp...,"{'Negative': 0.3161602, 'Neutral': 0.6419433, 'Positive': 0.04189655}"
Riga,it's good that the police are working as arborists and will tell you right away if the tree is bad or not and then you worry that the police will arrive after hours because they had to take pictures of the trees,"{'Negative': 0.21117237, 'Neutral': 0.45459422, 'Positive': 0.33423337}"
Riga,"you can find better places for that, not the sadi center. if you want graffiti areas or walls, then you can go for it and negotiate with the city. this is known as vandalism.","{'Negative': 0.49383864, 'Neutral': 0.46493462, 'Positive': 0.04122681}"
Riga,"i'll never understand that mentality to bake new things. what stupid scribblers, there's nothing even that pretty.","{'Negative': 0.9450758, 'Neutral': 0.04776074, 'Positive': 0.0071635437}"
Riga,", what a mess! , maybe you're training privates before you release serifs on the street, you're different and you look out of place!","{'Negative': 0.91274095, 'Neutral': 0.08034566, 'Positive': 0.006913375}"
Riga,we found one kepataj?!,"{'Negative': 0.0175386, 'Neutral': 0.634798, 'Positive': 0.34766343}"
Riga,"if any graffiti artist is reading this, they know what you're up to is not good. glitis is graffiti on a specific wall, which can be discussed with the owner, where a large graffiti is drawn with a touch of the cheek. all these pastries are herna","{'Negative': 0.8501606, 'Neutral': 0.13955493, 'Positive': 0.010284511}"
Riga,"laughed, can't deal with a car parked on the sidewalk and bike lane, it seems that there are no resources. will you put scooters here?","{'Negative': 0.80285954, 'Neutral': 0.17365752, 'Positive': 0.023482937}"
Riga,"well yes! it is always interesting to read what is written, which letters, how high, when sharp, how noticeable. i love graffiti and everything related to it!","{'Negative': 0.003124644, 'Neutral': 0.024408445, 'Positive': 0.97246695}"
Riga,tada is any protest booth. you disrupt the comfort of those who are comfortable to draw attention to your problem.,"{'Negative': 0.8018574, 'Neutral': 0.18762058, 'Positive': 0.010522053}"
Riga,cameras,"{'Negative': 0.22853611, 'Neutral': 0.6410864, 'Positive': 0.13037752}"
Riga,"interesting form of protest, destroy other's work and make everyone live in a pristine environment","{'Negative': 0.73409134, 'Neutral': 0.24076219, 'Positive': 0.02514644}"
Riga,cameras and order passports to remove sastradato,"{'Negative': 0.2340946, 'Neutral': 0.74428606, 'Positive': 0.021619324}"
Riga,could you see the funeral that you get to the sum of sis?,"{'Negative': 0.2037765, 'Neutral': 0.773286, 'Positive': 0.02293753}"
Riga,"pag, do you like tags? what about the court?","{'Negative': 0.07496947, 'Neutral': 0.8899125, 'Positive': 0.03511805}"
Riga,"riga traffic lifts are often rented out to subservices, so they can just as well be arborists who do pruning so as not to interfere with the safety of the contact network.","{'Negative': 0.21044861, 'Neutral': 0.7399273, 'Positive': 0.04962409}"
Riga,says the young ones have more to lose...,"{'Negative': 0.53274447, 'Neutral': 0.43794015, 'Positive': 0.029315425}"
Riga,"speak the language of the courts, you should turn the remaining roadway into a sidewalk and close the street to cars.","{'Negative': 0.19246317, 'Neutral': 0.77857286, 'Positive': 0.028963873}"
Riga,"""the trees are frozen, so they die, just like the free street""","{'Negative': 0.6496776, 'Neutral': 0.32374135, 'Positive': 0.026581062}"
Riga,"if you work honestly, an arborist consultation would be enough. that's a lot of money to spend on maintenance. (our money)","{'Negative': 0.4404384, 'Neutral': 0.45898414, 'Positive': 0.100577496}"
Riga,"i like it! enlivens the environment and has something to look at. what's more - that street was closed for half a year without any guards or cameras, what do you want!","{'Negative': 0.0564356, 'Neutral': 0.24482308, 'Positive': 0.6987414}"
Riga,"mm, graffiti expert studio! tell me, what is graffiti? the fact that street-art is quite popular does not mean that it is graffiti. graffiti is tagging, tagging your name on the wall, not pretty signs.","{'Negative': 0.44671676, 'Neutral': 0.48134813, 'Positive': 0.07193513}"
Riga,it is if it falls. public works support,"{'Negative': 0.13469626, 'Neutral': 0.7592438, 'Positive': 0.10605997}"
Riga,"i want to remind you that from the point of view of social anthropology, a large amount of graffiti shows that the territory has no owner. or he does not control the territory. i was just in new york, and in the ""normal"" areas of the city, there is no graffiti (the understanding of cookies) at all.","{'Negative': 0.31197852, 'Neutral': 0.63030756, 'Positive': 0.057713926}"
Riga,"video cameras, social work like washing/painting cookies, all expenses are covered by the baker","{'Negative': 0.07530866, 'Neutral': 0.8599227, 'Positive': 0.0647687}"
Riga,the micro-restriction of the guard of the alleys (i don't know if the visible place is correctly depicted).,"{'Negative': 0.38699278, 'Neutral': 0.5792064, 'Positive': 0.03380083}"
Riga,feel free to write an e-mail if it works,"{'Negative': 0.008400961, 'Neutral': 0.49266422, 'Positive': 0.4989348}"
Riga,will probably write to those passport inspectors about it,"{'Negative': 0.045192633, 'Neutral': 0.91474664, 'Positive': 0.040060766}"
Riga,"i already called , i can't call the environmental department.","{'Negative': 0.46563008, 'Neutral': 0.49448642, 'Positive': 0.03988352}"
Riga,this is not graffiti. they are tags,"{'Negative': 0.35001788, 'Neutral': 0.5877173, 'Positive': 0.062264808}"
Riga,and definitely fix thick roots that have been cut off.,"{'Negative': 0.42416516, 'Neutral': 0.5362182, 'Positive': 0.039616574}"
Riga,which year's . mk regulations?,"{'Negative': 0.12100245, 'Neutral': 0.8445271, 'Positive': 0.034470346}"
Riga,"definitely call the rpp and environmental control department, i invite you to contact one of the main vegetation inspectors:","{'Negative': 0.018661706, 'Neutral': 0.60265726, 'Positive': 0.37868103}"
Riga,peace. linden trees will survive.,"{'Negative': 0.017307607, 'Neutral': 0.4262986, 'Positive': 0.5563938}"
Riga,and why can't the pipes be dug somewhere other than on the roadway?,"{'Negative': 0.5753857, 'Neutral': 0.4107057, 'Positive': 0.0139085995}"
Riga,cameras and big fines.,"{'Negative': 0.3837227, 'Neutral': 0.55694896, 'Positive': 0.059328366}"
Riga,"these are the cooking that degrades the surrounding environment. riga del looks like one big ghetto to them. people, we will not be indifferent if we see beaten idiots! mobile phones for everyone, video recorders for many, we film and help to get rid of our rig! we must be punished for roasting in the desert.","{'Negative': 0.9382453, 'Neutral': 0.056060497, 'Positive': 0.005694301}"
Riga,"use other methods. there are special tools that can be used without damaging the roots. those trees cost hundreds of thousands of euros, for that money you can do cartigi works.","{'Negative': 0.21651766, 'Neutral': 0.58808386, 'Positive': 0.19539845}"
Riga,suggestions? live without sewage?,"{'Negative': 0.16214406, 'Neutral': 0.7894813, 'Positive': 0.04837462}"
Riga,"question, has anyone done it? and what will happen if after a while you break the pavement and you are told to dig there? will anyone notice that the other half of the roots are gone? and then you can shout again that the trees in the city are safe. bistami are idiots who let sadi stradat!","{'Negative': 0.6983868, 'Neutral': 0.26946172, 'Positive': 0.032151505}"
Riga,"gaujas iela , brasa bridge. do you know if are certified arborists who can take care of trees?","{'Negative': 0.034662038, 'Neutral': 0.9143418, 'Positive': 0.050996114}"
Riga,what are they doing there? your mash area,"{'Negative': 0.0715876, 'Neutral': 0.89261836, 'Positive': 0.03579397}"
Riga,"koknese prospect again chooses the easiest cell. gays can wait. , please remind me about regulations of the cabinet of ministers!","{'Negative': 0.18495771, 'Neutral': 0.6541843, 'Positive': 0.16085802}"
Riga,"linden trees. if it has an injury (reduces) the root system, then it is better to carry out crown pruning. and continues to grow exponentially. resistance to injury is one of the advantages of linden trees. recommended urban environment.","{'Negative': 0.04290879, 'Neutral': 0.318848, 'Positive': 0.6382432}"
Riga,"it is a protest of a new generation against the dictates of an old generation. the more you have it, the greater the joy for them.","{'Negative': 0.03869654, 'Neutral': 0.2717614, 'Positive': 0.6895421}"
Riga,"tree alley of koknese prospect. do you know how long these trees will be there, after these works with heavy equipment to cm from the trunk?","{'Negative': 0.09116566, 'Neutral': 0.8758517, 'Positive': 0.032982636}"
Riga,"straight people make you beautiful, without them it's more ""ideal"", cities without graffiti are scary, it means that there is no cartiba","{'Negative': 0.32626325, 'Neutral': 0.42107186, 'Positive': 0.25266483}"
Riga,"it's not graffiti! it is some kind of description of sical territories. one appears - look, and already ntie next to it.","{'Negative': 0.19658343, 'Neutral': 0.6862919, 'Positive': 0.11712473}"
Riga,"some time ago there were rumors that rd was a plan, but lkm. there was no mention of it anywhere.","{'Negative': 0.30971885, 'Neutral': 0.66255057, 'Positive': 0.027730541}"
Riga,i % support the fight against these cripples with a spray drum! i would like to cut off my fingers!,"{'Negative': 0.792189, 'Neutral': 0.17160207, 'Positive': 0.03620892}"
Riga,better graffiti than braces murals,"{'Negative': 0.34541318, 'Neutral': 0.5543476, 'Positive': 0.10023919}"
Riga,yap.. nutrition.. and nutrition!!!,"{'Negative': 0.0389172, 'Neutral': 0.553759, 'Positive': 0.4073238}"
Riga,"i doubt that this is the case (but maybe i'm wrong).gertrude street is generally quite a dull sight: it seems like a beautiful, barely renovated street, but there is graffiti on every bench and pot, it already looks thoroughly degraded.","{'Negative': 0.7619999, 'Neutral': 0.19411391, 'Positive': 0.043886244}"
Riga,theoretically if anti-graffiti is applied strongly... then it can come off,"{'Negative': 0.39634982, 'Neutral': 0.5745027, 'Positive': 0.029147495}"
Riga,"gertrudes street has not even been put into operation yet, so half of the new improvement is already covered with graffiti.does the city council have any plan to deal with this kind of vandalism?","{'Negative': 0.85373265, 'Neutral': 0.13670532, 'Positive': 0.009561958}"
Riga,work cp collaborated with,"{'Negative': 0.038614526, 'Neutral': 0.8709024, 'Positive': 0.090483055}"
Riga,". takes a look at the possible provocations during the may th protest action in riga, the courage of the riga city council, corruption and corruption prevention committee was appointed by the president of the rpp juris lukass. the police, however, averting possible confrontations and inciting public discord.","{'Negative': 0.25237274, 'Neutral': 0.7058027, 'Positive': 0.041824583}"
Riga,"to protect against fear, will place a temporary surveillance camera at the tactile freedom monument, today the deputies of the riga city council's security, corruption and corruption prevention committee were informed by rpp president juris lukass.","{'Negative': 0.1746046, 'Neutral': 0.7985087, 'Positive': 0.02688673}"
Riga,"bike patrols could very effectively control the use of phones at the steering wheel center, during traffic jams.according to my observations, /3 of the driver's nose is the screen.","{'Negative': 0.13181272, 'Neutral': 0.61383563, 'Positive': 0.2543516}"
Riga,resnuli,"{'Negative': 0.218791, 'Neutral': 0.6063558, 'Positive': 0.17485324}"
Riga,i think the bolt itself is there. it was before the game.,"{'Negative': 0.109305635, 'Neutral': 0.82389313, 'Positive': 0.06680118}"
Riga,"it's not the wheels that are to blame, but the driving culture and the ability to empathize... that's where i invested! before dropping, think twice!","{'Negative': 0.41897023, 'Neutral': 0.49025515, 'Positive': 0.0907746}"
Riga,"what will you do there if does not participate in any of these ""events"". everything ended that is capable of is driving around with wheels in the center and punishing wrongly parked delivery cars.","{'Negative': 0.6759022, 'Neutral': 0.30344585, 'Positive': 0.020651927}"
Riga,"it's a cool place, but no one caresand also seit, the principle, the rujina does not even stand (it is also possible to leave) and yards full of people who drive on the asphalt with a spot on the green, passers-by like a sugar bowl...","{'Negative': 0.27696496, 'Neutral': 0.49069962, 'Positive': 0.23233545}"
Riga,what do i want?,"{'Negative': 0.17613523, 'Neutral': 0.7648271, 'Positive': 0.059037667}"
Riga,technologies already,"{'Negative': 0.3303695, 'Neutral': 0.60066634, 'Positive': 0.06896425}"
Riga,make a seasonal timelapse,"{'Negative': 0.07357068, 'Neutral': 0.84634656, 'Positive': 0.0800827}"
Riga,and the mobile app can easily do it,"{'Negative': 0.006969994, 'Neutral': 0.15137452, 'Positive': 0.8416555}"
Riga,"can you please comment on riga's strategy for nudists on the beach? they have been too lazy to go to the nudist area for a long time. but this year, nudists already proudly court the beach near the beach area, which is the territory of riga and a public place.","{'Negative': 0.34502545, 'Neutral': 0.53515583, 'Positive': 0.11981868}"
Riga,what do you do with sadim who don't drive through the green zone only if teleport is invented?,"{'Negative': 0.29112303, 'Neutral': 0.68313086, 'Positive': 0.025746051}"
Riga,"who knows about a car that stands on the side of the street for a long time, there is not enough space to leave the car... or ?","{'Negative': 0.49839577, 'Neutral': 0.47793669, 'Positive': 0.023667566}"
Riga,guys!respect!,"{'Negative': 0.03851949, 'Neutral': 0.391011, 'Positive': 0.5704695}"
Riga,"again, it would be very important for and/or to finally start paying more attention to those driving in this lane. today, at three o'clock, the lane of zzelazava street between starka and vejava street was more filled with cars than the adjacent lane.","{'Negative': 0.26525885, 'Neutral': 0.5651554, 'Positive': 0.16958582}"
Riga,"riga's swimming areas are ready for the swimming season! glabeji in the summer season, the eight official swimming spots in riga, as well as near the resting place kisezer. the older riga beach will also use drones on a daily basis. more:","{'Negative': 0.005816053, 'Neutral': 0.6436722, 'Positive': 0.3505117}"
Riga,"riga is open! together with glabejie, we invite you to swim responsibly and use the city's official swimming areas. the inspection of lifeguard equipment also has the experience of swimming pools - kipsala beach castles. may everyone have a refreshing and most importantly - safe swimming!","{'Negative': 0.001836864, 'Neutral': 0.07183704, 'Positive': 0.9263261}"
Riga,"tell me, please, what is the meaning of ""summer cafes, which are allowed to smoke only in places specially designated for smoking"" in the smoking regulations? what does it bring? and is there also something for a separate non-smoking area?","{'Negative': 0.26763758, 'Neutral': 0.68340516, 'Positive': 0.048957206}"
Riga,won't be there because no. a sign!,"{'Negative': 0.56776994, 'Neutral': 0.37990457, 'Positive': 0.0523255}"
Riga,resnuli!,"{'Negative': 0.05286191, 'Neutral': 0.6994976, 'Positive': 0.24764049}"
Riga,i know that,"{'Negative': 0.32135484, 'Neutral': 0.5203554, 'Positive': 0.1582897}"
Riga,so close to them.,"{'Negative': 0.05654418, 'Neutral': 0.67903507, 'Positive': 0.2644207}"
Riga,"izi.if and are impotent, then only closer and on the sidewalk.but if you ask me, then the turning lane of stabu street between and p.m., who allows it .rules","{'Negative': 0.16974372, 'Neutral': 0.7860575, 'Positive': 0.044198826}"
Riga,will there ever be a reaction to this?,"{'Negative': 0.3574608, 'Neutral': 0.6239262, 'Positive': 0.018613055}"
Riga,"has no reason to go because everything is agreed with . mate... there is no victim in the camera, it probably doesn't matter.oh, and what's the trouble about?what happened is that we have been recovering from the repairs of deglava street for more than months already. or close to it.","{'Negative': 0.4557377, 'Neutral': 0.46885735, 'Positive': 0.075404994}"
Riga,"says that burning in parks is not allowed, but i'm not % convinced. what does say?","{'Negative': 0.5911553, 'Neutral': 0.38912424, 'Positive': 0.019720487}"
Riga,"oooo, bastards, hahah... fat unfortunates","{'Negative': 0.93253934, 'Neutral': 0.058088727, 'Positive': 0.009371914}"
Riga,"nichego, ie postaraisia.","{'Negative': 0.17847587, 'Neutral': 0.7074753, 'Positive': 0.11404882}"
Riga,i'm sorry i don't understand chinese language for year,"{'Negative': 0.9141796, 'Neutral': 0.07770155, 'Positive': 0.008118802}"
Riga,"etomu govnu v forme pokhui na tvoi problemy ilikakoi-to rosiiskii avto. oni zainteresovany poimet' tebia i tvoi kosheliok, a ne kakogo-to priezzhego rashkovanina. kotoryi vsio ravno nikogda ne zaplatit. eto tebe ne otvertet'sia, a rashkovaninu pokh.","{'Negative': 0.10599927, 'Neutral': 0.8474359, 'Positive': 0.046564803}"
Riga,or have you gone?,"{'Negative': 0.17889403, 'Neutral': 0.7425331, 'Positive': 0.0785729}"
Riga,"the police must have been busy with student kertisana, checking if someone had bought an energy drink or saltine. god forbid - beznicotina vape. and of course, when crews guarded half the monument. if this naked man is a distraction!!!!","{'Negative': 0.85558224, 'Neutral': 0.13471894, 'Positive': 0.009698854}"
Riga,for my money and the performance of my wishes. i would like to see you whenever possible.,"{'Negative': 0.0057063918, 'Neutral': 0.1566339, 'Positive': 0.8376598}"
Riga,so go get frosty and protect your warm clothes,"{'Negative': 0.02403571, 'Neutral': 0.55885476, 'Positive': 0.41710952}"
Riga,"i think that you have to wait minutes, it's too long to get to the city center, knowing that children and young people also go there. i understand - crews at the arena riga, because hockey, but don't forget that something is happening in other parts of the city as well.","{'Negative': 0.48614967, 'Neutral': 0.44853663, 'Positive': 0.06531369}"
Riga,liquidate that store!!!!!,"{'Negative': 0.8486863, 'Neutral': 0.1348447, 'Positive': 0.01646897}"
Riga,it's me wanna talk about it?,"{'Negative': 0.015933119, 'Neutral': 0.73548514, 'Positive': 0.24858172}"
Riga,"aha, there is a sign that video processing is done, but then it is not done. thanks for the info.","{'Negative': 0.36101893, 'Neutral': 0.55987316, 'Positive': 0.079107925}"
Riga,ok thanks. is it possible to make such a mistake if there is no real development?,"{'Negative': 0.3634929, 'Neutral': 0.5593997, 'Positive': 0.077107325}"
Riga,"i walk along .janvara street, i see a naked man lying. i call , i say what's the matter. wait less than minutes for the crew? the second one came, he took his things and left naked. it's a common practice here, to let people walk around naked, not to blindfold them?","{'Negative': 0.5888465, 'Neutral': 0.3922058, 'Positive': 0.01894766}"
Riga,called ?,"{'Negative': 0.22511292, 'Neutral': 0.610521, 'Positive': 0.16436608}"
Riga,"is already doing the usual info campaigns, and why don't you tell me - i'm preparing parking spaces for the riga, well, it's a good idea not to use them unless necessary, plus the message that riga is quieter, friendlier, greener, etc., and it's no longer necessary to stop where don't worry, something like that.","{'Negative': 0.08182008, 'Neutral': 0.42132357, 'Positive': 0.4968563}"
Riga,thank you for making the city gay and bike friendly.,"{'Negative': 0.019370604, 'Neutral': 0.13412394, 'Positive': 0.8465054}"
Riga,products have already been delivered to stores.,"{'Negative': 0.03841298, 'Neutral': 0.8025278, 'Positive': 0.15905923}"
Riga,"you may not know, but the principle is probably the shop's responsibility to communicate it to its customers.i can't find it now, but there was a funny incident when someone parked on the sidewalk of caka street, meters away from the parking space. ""rda apgerbi"" was written on the bus.","{'Negative': 0.27522388, 'Neutral': 0.61795497, 'Positive': 0.10682117}"
Riga,"this truth could be even easier than stretching across the sidewalk, i also have work experience with t pallets. the problem could be that informational campaigns are needed - they put signs and the idea that everything is done with it. i believe that the driver does not even know that there is such a stop.","{'Negative': 0.3518764, 'Neutral': 0.4781723, 'Positive': 0.1699513}"
Riga,"judging by the double line of the road and the pukupots placed on the sidewalk, the area of the store is intended from the side of the yard, i simply do not see any other legal possibilities for the existence of the store.","{'Negative': 0.63261783, 'Neutral': 0.34302735, 'Positive': 0.024354877}"
Riga,those passports and the management of the company have an idea about it.,"{'Negative': 0.08669225, 'Neutral': 0.87814385, 'Positive': 0.035163943}"
Riga,everyday paradise private territory riga brivibas . (just as i wrote the card e-mail last year and i know the application) (i just called - no penalties are possible) (a solution with discarded wheels town?),"{'Negative': 0.08013493, 'Neutral': 0.76843005, 'Positive': 0.15143502}"
Riga,why can't you deliver?,"{'Negative': 0.82285345, 'Neutral': 0.16791688, 'Positive': 0.009229787}"
Riga,not only selfish. veloegoista del millions. you will never be able to deliver bulk goods to millions of customers.,"{'Negative': 0.85786957, 'Neutral': 0.12948088, 'Positive': 0.012649625}"
Riga,parking space just around the corner.,"{'Negative': 0.0147074275, 'Neutral': 0.71603847, 'Positive': 0.26925415}"
Riga,"that's right, it's also an annual paid parking space, every box is unloaded, placed, delivered, recarried, one selfish person can't deliver the goods to customers","{'Negative': 0.5391933, 'Neutral': 0.3954022, 'Positive': 0.06540455}"
Riga,it's easier on the back. jane's hands.,"{'Negative': 0.043560408, 'Neutral': 0.4804922, 'Positive': 0.47594744}"
Riga,"because carts haven't been invented in latvia yet, only peacocks.","{'Negative': 0.50649345, 'Neutral': 0.4669998, 'Positive': 0.026506765}"
Riga,"yes, and i carried kg of sausages and gala soferits on my back.","{'Negative': 0.06090861, 'Neutral': 0.80896384, 'Positive': 0.1301276}"
Riga,behind the corner post there are parking spaces.,"{'Negative': 0.067245185, 'Neutral': 0.8468005, 'Positive': 0.08595436}"
Riga,have you tried to put yourself in the place of the guy who makes deliveries for companies. where do you leave the car?,"{'Negative': 0.28754777, 'Neutral': 0.6821489, 'Positive': 0.030303359}"
Riga,for your money,"{'Negative': 0.259824, 'Neutral': 0.6528997, 'Positive': 0.08727627}"
